"No.","Time","Source","Destination","Protocol","Length","Info"
"1","0.000000000","10.0.0.32","213.8.195.70","TCP","74","40920  >  80 [SYN] Seq=0 Win=29200 Len=0 MSS=1460 SACK_PERM=1 TSval=2621379022 TSecr=0 WS=128"
"2","0.011719326","213.8.195.70","10.0.0.32","TCP","74","80  >  40920 [SYN, ACK] Seq=0 Ack=1 Win=8192 Len=0 MSS=1452 WS=256 SACK_PERM=1 TSval=728635331 TSecr=2621379022"
"3","0.011743953","10.0.0.32","213.8.195.70","TCP","66","40920  >  80 [ACK] Seq=1 Ack=1 Win=29312 Len=0 TSval=2621379034 TSecr=728635331"
"4","0.128590854","10.0.0.32","213.8.195.70","HTTP","562","GET / HTTP/1.1 "
"5","0.180366267","213.8.195.70","10.0.0.32","TCP","2946","80  >  40920 [ACK] Seq=1 Ack=497 Win=132352 Len=2880 TSval=728635348 TSecr=2621379151 [TCP segment of a reassembled PDU]"
"6","0.180378940","10.0.0.32","213.8.195.70","TCP","66","40920  >  80 [ACK] Seq=497 Ack=2881 Win=35072 Len=0 TSval=2621379202 TSecr=728635348"
"7","0.191215245","213.8.195.70","10.0.0.32","TCP","1506","80  >  40920 [ACK] Seq=2881 Ack=497 Win=132352 Len=1440 TSval=728635349 TSecr=2621379202 [TCP segment of a reassembled PDU]"
"8","0.191221935","10.0.0.32","213.8.195.70","TCP","66","40920  >  80 [ACK] Seq=497 Ack=4321 Win=37888 Len=0 TSval=2621379213 TSecr=728635349"
"9","0.191481358","213.8.195.70","10.0.0.32","TCP","1506","80  >  40920 [ACK] Seq=4321 Ack=497 Win=132352 Len=1440 TSval=728635349 TSecr=2621379202 [TCP segment of a reassembled PDU]"
"10","0.191489668","10.0.0.32","213.8.195.70","TCP","66","40920  >  80 [ACK] Seq=497 Ack=5761 Win=40832 Len=0 TSval=2621379213 TSecr=728635349"
"11","0.191736273","213.8.195.70","10.0.0.32","TCP","2946","80  >  40920 [ACK] Seq=5761 Ack=497 Win=132352 Len=2880 TSval=728635349 TSecr=2621379202 [TCP segment of a reassembled PDU]"
"12","0.191745815","10.0.0.32","213.8.195.70","TCP","66","40920  >  80 [ACK] Seq=497 Ack=8641 Win=46592 Len=0 TSval=2621379214 TSecr=728635349"
"13","0.201954863","213.8.195.70","10.0.0.32","TCP","2946","80  >  40920 [ACK] Seq=8641 Ack=497 Win=132352 Len=2880 TSval=728635350 TSecr=2621379213 [TCP segment of a reassembled PDU]"
"14","0.201963738","10.0.0.32","213.8.195.70","TCP","66","40920  >  80 [ACK] Seq=497 Ack=11521 Win=52352 Len=0 TSval=2621379224 TSecr=728635350"
"15","0.202193530","213.8.195.70","10.0.0.32","HTTP","1897","HTTP/1.1 200 OK  (text/html)"
"16","0.202197065","10.0.0.32","213.8.195.70","TCP","66","40920  >  80 [ACK] Seq=497 Ack=13352 Win=55936 Len=0 TSval=2621379224 TSecr=728635350"
"17","0.226010342","10.0.0.32","213.8.195.70","HTTP","589","GET /bundles/bundledCss?v=5peb9OyJOJYrHJlExsV9OZzNYp-Qx3dIpg_JI5Zyz381 HTTP/1.1 "
"18","0.226459872","10.0.0.32","213.8.195.70","TCP","74","40934  >  80 [SYN] Seq=0 Win=29200 Len=0 MSS=1460 SACK_PERM=1 TSval=2621379248 TSecr=0 WS=128"
"19","0.237952423","213.8.195.70","10.0.0.32","TCP","74","80  >  40934 [SYN, ACK] Seq=0 Ack=1 Win=8192 Len=0 MSS=1452 WS=256 SACK_PERM=1 TSval=728635354 TSecr=2621379248"
"20","0.237994310","10.0.0.32","213.8.195.70","TCP","66","40934  >  80 [ACK] Seq=1 Ack=1 Win=29312 Len=0 TSval=2621379260 TSecr=728635354"
"21","0.238336545","10.0.0.32","213.8.195.70","HTTP","572","GET /bundles/bottomJS?v=2OFvU9_yEiPzGfni5EgkQJ9YzO0CYtkqIIbTK0CWY1c1 HTTP/1.1 "
"22","0.256085637","10.0.0.32","213.8.195.70","TCP","66","40920  >  80 [FIN, ACK] Seq=1020 Ack=13352 Win=55936 Len=0 TSval=2621379278 TSecr=728635350"
"23","0.256241501","10.0.0.32","213.8.195.70","TCP","74","40940  >  80 [SYN] Seq=0 Win=29200 Len=0 MSS=1460 SACK_PERM=1 TSval=2621379278 TSecr=0 WS=128"
"24","0.266362911","213.8.195.70","10.0.0.32","TCP","66","80  >  40920 [ACK] Seq=13352 Ack=1021 Win=131840 Len=0 TSval=728635356 TSecr=2621379248"
"25","0.267940417","213.8.195.70","10.0.0.32","TCP","74","80  >  40940 [SYN, ACK] Seq=0 Ack=1 Win=8192 Len=0 MSS=1452 WS=256 SACK_PERM=1 TSval=728635357 TSecr=2621379278"
"26","0.267958831","10.0.0.32","213.8.195.70","TCP","66","40940  >  80 [ACK] Seq=1 Ack=1 Win=29312 Len=0 TSval=2621379290 TSecr=728635357"
"27","0.268112538","10.0.0.32","213.8.195.70","HTTP","551","GET /Content/images/palmach_logo.jpg HTTP/1.1 "
"28","0.312978933","213.8.195.70","10.0.0.32","TCP","2946","80  >  40940 [ACK] Seq=1 Ack=486 Win=132352 Len=2880 TSval=728635361 TSecr=2621379290 [TCP segment of a reassembled PDU]"
"29","0.312992086","10.0.0.32","213.8.195.70","TCP","66","40940  >  80 [ACK] Seq=486 Ack=2881 Win=35072 Len=0 TSval=2621379335 TSecr=728635361"
"30","0.314171381","213.8.195.70","10.0.0.32","TCP","1506","80  >  40934 [ACK] Seq=1 Ack=507 Win=132352 Len=1440 TSval=728635361 TSecr=2621379260 [TCP segment of a reassembled PDU]"
"31","0.314178905","10.0.0.32","213.8.195.70","TCP","66","40934  >  80 [ACK] Seq=507 Ack=1441 Win=32128 Len=0 TSval=2621379336 TSecr=728635361"
"32","0.314438122","213.8.195.70","10.0.0.32","TCP","1506","80  >  40934 [ACK] Seq=1441 Ack=507 Win=132352 Len=1440 TSval=728635361 TSecr=2621379260 [TCP segment of a reassembled PDU]"
"33","0.314443804","10.0.0.32","213.8.195.70","TCP","66","40934  >  80 [ACK] Seq=507 Ack=2881 Win=35072 Len=0 TSval=2621379336 TSecr=728635361"
"34","0.315773379","213.8.195.70","10.0.0.32","TCP","1506","80  >  40920 [ACK] Seq=13352 Ack=1021 Win=131840 Len=1440 TSval=728635361 TSecr=2621379248 [TCP segment of a reassembled PDU]"
"35","0.315785348","10.0.0.32","213.8.195.70","TCP","54","40920  >  80 [RST] Seq=1021 Win=0 Len=0"
"36","0.316272261","213.8.195.70","10.0.0.32","TCP","1506","80  >  40920 [ACK] Seq=14792 Ack=1021 Win=131840 Len=1440 TSval=728635361 TSecr=2621379248 [TCP segment of a reassembled PDU]"
"37","0.316275209","10.0.0.32","213.8.195.70","TCP","54","40920  >  80 [RST] Seq=1021 Win=0 Len=0"
"38","0.316532432","213.8.195.70","10.0.0.32","TCP","1506","80  >  40920 [ACK] Seq=16232 Ack=1021 Win=131840 Len=1440 TSval=728635361 TSecr=2621379248 [TCP segment of a reassembled PDU]"
"39","0.316534952","10.0.0.32","213.8.195.70","TCP","54","40920  >  80 [RST] Seq=1021 Win=0 Len=0"
"40","0.316784277","213.8.195.70","10.0.0.32","TCP","1506","80  >  40920 [ACK] Seq=17672 Ack=1021 Win=131840 Len=1440 TSval=728635361 TSecr=2621379248 [TCP segment of a reassembled PDU]"
"41","0.316786381","10.0.0.32","213.8.195.70","TCP","54","40920  >  80 [RST] Seq=1021 Win=0 Len=0"
"42","0.317036547","213.8.195.70","10.0.0.32","TCP","2946","80  >  40920 [ACK] Seq=19112 Ack=1021 Win=131840 Len=2880 TSval=728635361 TSecr=2621379248 [TCP segment of a reassembled PDU]"
"43","0.317039041","10.0.0.32","213.8.195.70","TCP","54","40920  >  80 [RST] Seq=1021 Win=0 Len=0"
"44","0.317295027","213.8.195.70","10.0.0.32","TCP","1506","80  >  40920 [ACK] Seq=21992 Ack=1021 Win=131840 Len=1440 TSval=728635361 TSecr=2621379248 [TCP segment of a reassembled PDU]"
"45","0.317297140","10.0.0.32","213.8.195.70","TCP","54","40920  >  80 [RST] Seq=1021 Win=0 Len=0"
"46","0.317548934","213.8.195.70","10.0.0.32","TCP","2946","80  >  40920 [ACK] Seq=23432 Ack=1021 Win=131840 Len=2880 TSval=728635361 TSecr=2621379248 [TCP segment of a reassembled PDU]"
"47","0.317556014","10.0.0.32","213.8.195.70","TCP","54","40920  >  80 [RST] Seq=1021 Win=0 Len=0"
"48","0.317799764","213.8.195.70","10.0.0.32","TCP","1506","80  >  40920 [ACK] Seq=26312 Ack=1021 Win=131840 Len=1440 TSval=728635361 TSecr=2621379248 [TCP segment of a reassembled PDU]"
"49","0.317806138","10.0.0.32","213.8.195.70","TCP","54","40920  >  80 [RST] Seq=1021 Win=0 Len=0"
"50","0.318063352","213.8.195.70","10.0.0.32","TCP","1506","HTTP/1.1 200 OK  [TCP segment of a reassembled PDU]"
"51","0.318068305","10.0.0.32","213.8.195.70","TCP","54","40920  >  80 [RST] Seq=1021 Win=0 Len=0"
"52","0.323774991","213.8.195.70","10.0.0.32","TCP","1506","80  >  40940 [ACK] Seq=2881 Ack=486 Win=132352 Len=1440 TSval=728635362 TSecr=2621379335 [TCP segment of a reassembled PDU]"
"53","0.323783969","10.0.0.32","213.8.195.70","TCP","66","40940  >  80 [ACK] Seq=486 Ack=4321 Win=37888 Len=0 TSval=2621379346 TSecr=728635362"
"54","0.324979103","213.8.195.70","10.0.0.32","HTTP","2330","HTTP/1.1 200 OK  (JPEG JFIF image)"
"55","0.324987098","10.0.0.32","213.8.195.70","TCP","66","40940  >  80 [ACK] Seq=486 Ack=6585 Win=42496 Len=0 TSval=2621379347 TSecr=728635362"
"56","0.325204881","213.8.195.70","10.0.0.32","TCP","2946","80  >  40934 [ACK] Seq=2881 Ack=507 Win=132352 Len=2880 TSval=728635362 TSecr=2621379336 [TCP segment of a reassembled PDU]"
"57","0.325211039","10.0.0.32","213.8.195.70","TCP","66","40934  >  80 [ACK] Seq=507 Ack=5761 Win=40832 Len=0 TSval=2621379347 TSecr=728635362"
"58","0.325454011","213.8.195.70","10.0.0.32","TCP","2946","80  >  40934 [ACK] Seq=5761 Ack=507 Win=132352 Len=2880 TSval=728635362 TSecr=2621379336 [TCP segment of a reassembled PDU]"
"59","0.325457802","10.0.0.32","213.8.195.70","TCP","66","40934  >  80 [ACK] Seq=507 Ack=8641 Win=46592 Len=0 TSval=2621379347 TSecr=728635362"
"60","0.335755675","213.8.195.70","10.0.0.32","TCP","1506","80  >  40934 [ACK] Seq=8641 Ack=507 Win=132352 Len=1440 TSval=728635363 TSecr=2621379347 [TCP segment of a reassembled PDU]"
"61","0.335764621","10.0.0.32","213.8.195.70","TCP","66","40934  >  80 [ACK] Seq=507 Ack=10081 Win=49408 Len=0 TSval=2621379358 TSecr=728635363"
"62","0.336008191","213.8.195.70","10.0.0.32","TCP","4386","80  >  40934 [ACK] Seq=10081 Ack=507 Win=132352 Len=4320 TSval=728635363 TSecr=2621379347 [TCP segment of a reassembled PDU]"
"63","0.336015850","10.0.0.32","213.8.195.70","TCP","66","40934  >  80 [ACK] Seq=507 Ack=14401 Win=58112 Len=0 TSval=2621379358 TSecr=728635363"
"64","0.336256170","213.8.195.70","10.0.0.32","TCP","1506","80  >  40934 [ACK] Seq=14401 Ack=507 Win=132352 Len=1440 TSval=728635363 TSecr=2621379347 [TCP segment of a reassembled PDU]"
"65","0.336261050","10.0.0.32","213.8.195.70","TCP","66","40934  >  80 [ACK] Seq=507 Ack=15841 Win=61056 Len=0 TSval=2621379358 TSecr=728635363"
"66","0.336515701","213.8.195.70","10.0.0.32","TCP","1506","80  >  40934 [ACK] Seq=15841 Ack=507 Win=132352 Len=1440 TSval=728635363 TSecr=2621379347 [TCP segment of a reassembled PDU]"
"67","0.336519391","10.0.0.32","213.8.195.70","TCP","66","40934  >  80 [ACK] Seq=507 Ack=17281 Win=63872 Len=0 TSval=2621379358 TSecr=728635363"
"68","0.336768132","213.8.195.70","10.0.0.32","TCP","2946","80  >  40934 [ACK] Seq=17281 Ack=507 Win=132352 Len=2880 TSval=728635363 TSecr=2621379347 [TCP segment of a reassembled PDU]"
"69","0.336773167","10.0.0.32","213.8.195.70","TCP","66","40934  >  80 [ACK] Seq=507 Ack=20161 Win=69632 Len=0 TSval=2621379359 TSecr=728635363"
"70","0.346188756","213.8.195.70","10.0.0.32","TCP","2946","80  >  40934 [ACK] Seq=20161 Ack=507 Win=132352 Len=2880 TSval=728635364 TSecr=2621379358 [TCP segment of a reassembled PDU]"
"71","0.346198520","10.0.0.32","213.8.195.70","TCP","66","40934  >  80 [ACK] Seq=507 Ack=23041 Win=75392 Len=0 TSval=2621379368 TSecr=728635364"
"72","0.346678270","213.8.195.70","10.0.0.32","TCP","2946","80  >  40934 [ACK] Seq=23041 Ack=507 Win=132352 Len=2880 TSval=728635364 TSecr=2621379358 [TCP segment of a reassembled PDU]"
"73","0.346685353","10.0.0.32","213.8.195.70","TCP","66","40934  >  80 [ACK] Seq=507 Ack=25921 Win=81152 Len=0 TSval=2621379369 TSecr=728635364"
"74","0.346944668","213.8.195.70","10.0.0.32","TCP","1506","80  >  40934 [ACK] Seq=25921 Ack=507 Win=132352 Len=1440 TSval=728635364 TSecr=2621379358 [TCP segment of a reassembled PDU]"
"75","0.346950518","10.0.0.32","213.8.195.70","TCP","66","40934  >  80 [ACK] Seq=507 Ack=27361 Win=84096 Len=0 TSval=2621379369 TSecr=728635364"
"76","0.347481450","213.8.195.70","10.0.0.32","TCP","4386","80  >  40934 [ACK] Seq=27361 Ack=507 Win=132352 Len=4320 TSval=728635364 TSecr=2621379358 [TCP segment of a reassembled PDU]"
"77","0.347487819","10.0.0.32","213.8.195.70","TCP","66","40934  >  80 [ACK] Seq=507 Ack=31681 Win=92672 Len=0 TSval=2621379369 TSecr=728635364"
"78","0.347725054","213.8.195.70","10.0.0.32","TCP","1506","80  >  40934 [ACK] Seq=31681 Ack=507 Win=132352 Len=1440 TSval=728635364 TSecr=2621379358 [TCP segment of a reassembled PDU]"
"79","0.347730207","10.0.0.32","213.8.195.70","TCP","66","40934  >  80 [ACK] Seq=507 Ack=33121 Win=95616 Len=0 TSval=2621379370 TSecr=728635364"
"80","0.347975745","213.8.195.70","10.0.0.32","TCP","1506","80  >  40934 [ACK] Seq=33121 Ack=507 Win=132352 Len=1440 TSval=728635364 TSecr=2621379358 [TCP segment of a reassembled PDU]"
"81","0.347980761","10.0.0.32","213.8.195.70","TCP","66","40934  >  80 [ACK] Seq=507 Ack=34561 Win=98560 Len=0 TSval=2621379370 TSecr=728635364"
"82","0.348227600","213.8.195.70","10.0.0.32","TCP","2946","80  >  40934 [ACK] Seq=34561 Ack=507 Win=132352 Len=2880 TSval=728635364 TSecr=2621379358 [TCP segment of a reassembled PDU]"
"83","0.348233284","10.0.0.32","213.8.195.70","TCP","66","40934  >  80 [ACK] Seq=507 Ack=37441 Win=104320 Len=0 TSval=2621379370 TSecr=728635364"
"84","0.349756732","213.8.195.70","10.0.0.32","TCP","1506","80  >  40934 [ACK] Seq=37441 Ack=507 Win=132352 Len=1440 TSval=728635364 TSecr=2621379359 [TCP segment of a reassembled PDU]"
"85","0.349764862","10.0.0.32","213.8.195.70","TCP","66","40934  >  80 [ACK] Seq=507 Ack=38881 Win=107136 Len=0 TSval=2621379372 TSecr=728635364"
"86","0.350009069","213.8.195.70","10.0.0.32","TCP","4386","80  >  40934 [ACK] Seq=38881 Ack=507 Win=132352 Len=4320 TSval=728635364 TSecr=2621379359 [TCP segment of a reassembled PDU]"
"87","0.350016447","10.0.0.32","213.8.195.70","TCP","66","40934  >  80 [ACK] Seq=507 Ack=43201 Win=115840 Len=0 TSval=2621379372 TSecr=728635364"
"88","0.356555818","213.8.195.70","10.0.0.32","TCP","1506","80  >  40934 [ACK] Seq=43201 Ack=507 Win=132352 Len=1440 TSval=728635365 TSecr=2621379368 [TCP segment of a reassembled PDU]"
"89","0.356565142","10.0.0.32","213.8.195.70","TCP","66","40934  >  80 [ACK] Seq=507 Ack=44641 Win=118656 Len=0 TSval=2621379379 TSecr=728635365"
"90","0.356817181","213.8.195.70","10.0.0.32","TCP","1506","80  >  40934 [ACK] Seq=44641 Ack=507 Win=132352 Len=1440 TSval=728635365 TSecr=2621379368 [TCP segment of a reassembled PDU]"
"91","0.356823713","10.0.0.32","213.8.195.70","TCP","66","40934  >  80 [ACK] Seq=507 Ack=46081 Win=121600 Len=0 TSval=2621379379 TSecr=728635365"
"92","0.357065984","213.8.195.70","10.0.0.32","TCP","1506","80  >  40934 [ACK] Seq=46081 Ack=507 Win=132352 Len=1440 TSval=728635365 TSecr=2621379368 [TCP segment of a reassembled PDU]"
"93","0.357069538","10.0.0.32","213.8.195.70","TCP","66","40934  >  80 [ACK] Seq=507 Ack=47521 Win=124544 Len=0 TSval=2621379379 TSecr=728635365"
"94","0.357327689","213.8.195.70","10.0.0.32","TCP","1506","80  >  40934 [ACK] Seq=47521 Ack=507 Win=132352 Len=1440 TSval=728635365 TSecr=2621379368 [TCP segment of a reassembled PDU]"
"95","0.357331275","10.0.0.32","213.8.195.70","TCP","66","40934  >  80 [ACK] Seq=507 Ack=48961 Win=127360 Len=0 TSval=2621379379 TSecr=728635365"
"96","0.357859077","213.8.195.70","10.0.0.32","TCP","2946","80  >  40934 [ACK] Seq=48961 Ack=507 Win=132352 Len=2880 TSval=728635365 TSecr=2621379369 [TCP segment of a reassembled PDU]"
"97","0.357864735","10.0.0.32","213.8.195.70","TCP","66","40934  >  80 [ACK] Seq=507 Ack=51841 Win=133120 Len=0 TSval=2621379380 TSecr=728635365"
"98","0.358092587","213.8.195.70","10.0.0.32","TCP","2946","80  >  40934 [ACK] Seq=51841 Ack=507 Win=132352 Len=2880 TSval=728635365 TSecr=2621379369 [TCP segment of a reassembled PDU]"
"99","0.358097381","10.0.0.32","213.8.195.70","TCP","66","40934  >  80 [ACK] Seq=507 Ack=54721 Win=138880 Len=0 TSval=2621379380 TSecr=728635365"
"100","0.358341992","213.8.195.70","10.0.0.32","TCP","1506","80  >  40934 [ACK] Seq=54721 Ack=507 Win=132352 Len=1440 TSval=728635365 TSecr=2621379369 [TCP segment of a reassembled PDU]"
"101","0.358346452","10.0.0.32","213.8.195.70","TCP","66","40934  >  80 [ACK] Seq=507 Ack=56161 Win=141824 Len=0 TSval=2621379380 TSecr=728635365"
"102","0.358592765","213.8.195.70","10.0.0.32","TCP","1506","80  >  40934 [ACK] Seq=56161 Ack=507 Win=132352 Len=1440 TSval=728635365 TSecr=2621379369 [TCP segment of a reassembled PDU]"
"103","0.358596991","10.0.0.32","213.8.195.70","TCP","66","40934  >  80 [ACK] Seq=507 Ack=57601 Win=144640 Len=0 TSval=2621379381 TSecr=728635365"
"104","0.358600654","213.8.195.70","10.0.0.32","TCP","1506","80  >  40934 [ACK] Seq=57601 Ack=507 Win=132352 Len=1440 TSval=728635366 TSecr=2621379369 [TCP segment of a reassembled PDU]"
"105","0.358604300","10.0.0.32","213.8.195.70","TCP","66","40934  >  80 [ACK] Seq=507 Ack=59041 Win=147584 Len=0 TSval=2621379381 TSecr=728635366"
"106","0.358849756","213.8.195.70","10.0.0.32","TCP","1506","80  >  40934 [ACK] Seq=59041 Ack=507 Win=132352 Len=1440 TSval=728635366 TSecr=2621379369 [TCP segment of a reassembled PDU]"
"107","0.358854330","10.0.0.32","213.8.195.70","TCP","66","40934  >  80 [ACK] Seq=507 Ack=60481 Win=150528 Len=0 TSval=2621379381 TSecr=728635366"
"108","0.359106832","213.8.195.70","10.0.0.32","TCP","1506","80  >  40934 [ACK] Seq=60481 Ack=507 Win=132352 Len=1440 TSval=728635366 TSecr=2621379369 [TCP segment of a reassembled PDU]"
"109","0.359111112","10.0.0.32","213.8.195.70","TCP","66","40934  >  80 [ACK] Seq=507 Ack=61921 Win=153344 Len=0 TSval=2621379381 TSecr=728635366"
"110","0.359358151","213.8.195.70","10.0.0.32","TCP","1506","80  >  40934 [ACK] Seq=61921 Ack=507 Win=132352 Len=1440 TSval=728635366 TSecr=2621379369 [TCP segment of a reassembled PDU]"
"111","0.359362392","10.0.0.32","213.8.195.70","TCP","66","40934  >  80 [ACK] Seq=507 Ack=63361 Win=156288 Len=0 TSval=2621379381 TSecr=728635366"
"112","0.359609673","213.8.195.70","10.0.0.32","TCP","2946","80  >  40934 [ACK] Seq=63361 Ack=507 Win=132352 Len=2880 TSval=728635366 TSecr=2621379369 [TCP segment of a reassembled PDU]"
"113","0.359614214","10.0.0.32","213.8.195.70","TCP","66","40934  >  80 [ACK] Seq=507 Ack=66241 Win=162048 Len=0 TSval=2621379382 TSecr=728635366"
"114","0.359859433","213.8.195.70","10.0.0.32","TCP","1506","80  >  40934 [ACK] Seq=66241 Ack=507 Win=132352 Len=1440 TSval=728635366 TSecr=2621379370 [TCP segment of a reassembled PDU]"
"115","0.359863647","10.0.0.32","213.8.195.70","TCP","66","40934  >  80 [ACK] Seq=507 Ack=67681 Win=164992 Len=0 TSval=2621379382 TSecr=728635366"
"116","0.360122555","213.8.195.70","10.0.0.32","TCP","1506","80  >  40934 [ACK] Seq=67681 Ack=507 Win=132352 Len=1440 TSval=728635366 TSecr=2621379370 [TCP segment of a reassembled PDU]"
"117","0.360126775","10.0.0.32","213.8.195.70","TCP","66","40934  >  80 [ACK] Seq=507 Ack=69121 Win=167808 Len=0 TSval=2621379382 TSecr=728635366"
"118","0.360964254","213.8.195.70","10.0.0.32","TCP","1506","80  >  40934 [PSH, ACK] Seq=69121 Ack=507 Win=132352 Len=1440 TSval=728635366 TSecr=2621379370 [TCP segment of a reassembled PDU]"
"119","0.360971175","10.0.0.32","213.8.195.70","TCP","66","40934  >  80 [ACK] Seq=507 Ack=70561 Win=170752 Len=0 TSval=2621379383 TSecr=728635366"
"120","0.360977345","213.8.195.70","10.0.0.32","TCP","1506","80  >  40934 [ACK] Seq=70561 Ack=507 Win=132352 Len=1440 TSval=728635366 TSecr=2621379370 [TCP segment of a reassembled PDU]"
"121","0.360981022","10.0.0.32","213.8.195.70","TCP","66","40934  >  80 [ACK] Seq=507 Ack=72001 Win=173568 Len=0 TSval=2621379383 TSecr=728635366"
"122","0.361195076","213.8.195.70","10.0.0.32","TCP","1506","80  >  40934 [ACK] Seq=72001 Ack=507 Win=132352 Len=1440 TSval=728635366 TSecr=2621379370 [TCP segment of a reassembled PDU]"
"123","0.361199976","10.0.0.32","213.8.195.70","TCP","66","40934  >  80 [ACK] Seq=507 Ack=73441 Win=176512 Len=0 TSval=2621379383 TSecr=728635366"
"124","0.361446538","213.8.195.70","10.0.0.32","TCP","2946","80  >  40934 [ACK] Seq=73441 Ack=507 Win=132352 Len=2880 TSval=728635366 TSecr=2621379370 [TCP segment of a reassembled PDU]"
"125","0.361451964","10.0.0.32","213.8.195.70","TCP","66","40934  >  80 [ACK] Seq=507 Ack=76321 Win=182272 Len=0 TSval=2621379383 TSecr=728635366"
"126","0.361695920","213.8.195.70","10.0.0.32","TCP","1506","80  >  40934 [ACK] Seq=76321 Ack=507 Win=132352 Len=1440 TSval=728635366 TSecr=2621379370 [TCP segment of a reassembled PDU]"
"127","0.361700266","10.0.0.32","213.8.195.70","TCP","66","40934  >  80 [ACK] Seq=507 Ack=77761 Win=184832 Len=0 TSval=2621379384 TSecr=728635366"
"128","0.361703914","213.8.195.70","10.0.0.32","TCP","1506","80  >  40934 [ACK] Seq=77761 Ack=507 Win=132352 Len=1440 TSval=728635366 TSecr=2621379372 [TCP segment of a reassembled PDU]"
"129","0.361706917","10.0.0.32","213.8.195.70","TCP","66","40934  >  80 [ACK] Seq=507 Ack=79201 Win=184192 Len=0 TSval=2621379384 TSecr=728635366"
"130","0.361948039","213.8.195.70","10.0.0.32","TCP","2946","80  >  40934 [ACK] Seq=79201 Ack=507 Win=132352 Len=2880 TSval=728635366 TSecr=2621379372 [TCP segment of a reassembled PDU]"
"131","0.361952571","10.0.0.32","213.8.195.70","TCP","66","40934  >  80 [ACK] Seq=507 Ack=82081 Win=184192 Len=0 TSval=2621379384 TSecr=728635366"
"132","0.362197432","213.8.195.70","10.0.0.32","TCP","1506","80  >  40934 [ACK] Seq=82081 Ack=507 Win=132352 Len=1440 TSval=728635366 TSecr=2621379372 [TCP segment of a reassembled PDU]"
"133","0.362201621","10.0.0.32","213.8.195.70","TCP","66","40934  >  80 [ACK] Seq=507 Ack=83521 Win=184832 Len=0 TSval=2621379384 TSecr=728635366"
"134","0.362450712","213.8.195.70","10.0.0.32","TCP","1506","80  >  40934 [ACK] Seq=83521 Ack=507 Win=132352 Len=1440 TSval=728635366 TSecr=2621379372 [TCP segment of a reassembled PDU]"
"135","0.362454883","10.0.0.32","213.8.195.70","TCP","66","40934  >  80 [ACK] Seq=507 Ack=84961 Win=184832 Len=0 TSval=2621379384 TSecr=728635366"
"136","0.362709548","213.8.195.70","10.0.0.32","TCP","2946","80  >  40934 [ACK] Seq=84961 Ack=507 Win=132352 Len=2880 TSval=728635366 TSecr=2621379372 [TCP segment of a reassembled PDU]"
"137","0.362714297","10.0.0.32","213.8.195.70","TCP","66","40934  >  80 [ACK] Seq=507 Ack=87841 Win=184192 Len=0 TSval=2621379385 TSecr=728635366"
"138","0.362959516","213.8.195.70","10.0.0.32","TCP","1506","80  >  40934 [ACK] Seq=87841 Ack=507 Win=132352 Len=1440 TSval=728635366 TSecr=2621379372 [TCP segment of a reassembled PDU]"
"139","0.362963773","10.0.0.32","213.8.195.70","TCP","66","40934  >  80 [ACK] Seq=507 Ack=89281 Win=184832 Len=0 TSval=2621379385 TSecr=728635366"
"140","0.366953106","213.8.195.70","10.0.0.32","TCP","1506","80  >  40934 [ACK] Seq=89281 Ack=507 Win=132352 Len=1440 TSval=728635366 TSecr=2621379379 [TCP segment of a reassembled PDU]"
"141","0.366959674","10.0.0.32","213.8.195.70","TCP","66","40934  >  80 [ACK] Seq=507 Ack=90721 Win=184832 Len=0 TSval=2621379389 TSecr=728635366"
"142","0.367185799","213.8.195.70","10.0.0.32","TCP","1506","80  >  40934 [ACK] Seq=90721 Ack=507 Win=132352 Len=1440 TSval=728635366 TSecr=2621379379 [TCP segment of a reassembled PDU]"
"143","0.367193845","10.0.0.32","213.8.195.70","TCP","66","40934  >  80 [ACK] Seq=507 Ack=92161 Win=184832 Len=0 TSval=2621379389 TSecr=728635366"
"144","0.367436990","213.8.195.70","10.0.0.32","TCP","2946","80  >  40934 [ACK] Seq=92161 Ack=507 Win=132352 Len=2880 TSval=728635366 TSecr=2621379379 [TCP segment of a reassembled PDU]"
"145","0.367442196","10.0.0.32","213.8.195.70","TCP","66","40934  >  80 [ACK] Seq=507 Ack=95041 Win=184192 Len=0 TSval=2621379389 TSecr=728635366"
"146","0.367700570","213.8.195.70","10.0.0.32","TCP","1506","80  >  40934 [ACK] Seq=95041 Ack=507 Win=132352 Len=1440 TSval=728635366 TSecr=2621379379 [TCP segment of a reassembled PDU]"
"147","0.367705018","10.0.0.32","213.8.195.70","TCP","66","40934  >  80 [ACK] Seq=507 Ack=96481 Win=184832 Len=0 TSval=2621379390 TSecr=728635366"
"148","0.367951280","213.8.195.70","10.0.0.32","TCP","1506","80  >  40934 [ACK] Seq=96481 Ack=507 Win=132352 Len=1440 TSval=728635366 TSecr=2621379379 [TCP segment of a reassembled PDU]"
"149","0.368201688","213.8.195.70","10.0.0.32","TCP","1506","80  >  40934 [ACK] Seq=97921 Ack=507 Win=132352 Len=1440 TSval=728635367 TSecr=2621379379 [TCP segment of a reassembled PDU]"
"150","0.368210362","10.0.0.32","213.8.195.70","TCP","66","40934  >  80 [ACK] Seq=507 Ack=99361 Win=184832 Len=0 TSval=2621379390 TSecr=728635366"
"151","0.368469562","213.8.195.70","10.0.0.32","TCP","1506","80  >  40934 [ACK] Seq=99361 Ack=507 Win=132352 Len=1440 TSval=728635367 TSecr=2621379379 [TCP segment of a reassembled PDU]"
"152","0.368721470","213.8.195.70","10.0.0.32","TCP","2946","80  >  40934 [ACK] Seq=100801 Ack=507 Win=132352 Len=2880 TSval=728635367 TSecr=2621379380 [TCP segment of a reassembled PDU]"
"153","0.368748139","10.0.0.32","213.8.195.70","TCP","66","40934  >  80 [ACK] Seq=507 Ack=103681 Win=184832 Len=0 TSval=2621379391 TSecr=728635367"
"154","0.368971515","213.8.195.70","10.0.0.32","TCP","1506","80  >  40934 [ACK] Seq=103681 Ack=507 Win=132352 Len=1440 TSval=728635367 TSecr=2621379380 [TCP segment of a reassembled PDU]"
"155","0.369374366","213.8.195.70","10.0.0.32","TCP","1506","80  >  40934 [ACK] Seq=105121 Ack=507 Win=132352 Len=1440 TSval=728635367 TSecr=2621379380 [TCP segment of a reassembled PDU]"
"156","0.369380852","10.0.0.32","213.8.195.70","TCP","66","40934  >  80 [ACK] Seq=507 Ack=106561 Win=184832 Len=0 TSval=2621379391 TSecr=728635367"
"157","0.369874130","213.8.195.70","10.0.0.32","TCP","2946","80  >  40934 [ACK] Seq=106561 Ack=507 Win=132352 Len=2880 TSval=728635367 TSecr=2621379380 [TCP segment of a reassembled PDU]"
"158","0.369901728","10.0.0.32","213.8.195.70","TCP","66","40934  >  80 [ACK] Seq=507 Ack=109441 Win=184832 Len=0 TSval=2621379392 TSecr=728635367"
"159","0.370123749","213.8.195.70","10.0.0.32","TCP","2946","80  >  40934 [ACK] Seq=109441 Ack=507 Win=132352 Len=2880 TSval=728635367 TSecr=2621379380 [TCP segment of a reassembled PDU]"
"160","0.370148615","10.0.0.32","213.8.195.70","TCP","66","40934  >  80 [ACK] Seq=507 Ack=112321 Win=184832 Len=0 TSval=2621379392 TSecr=728635367"
"161","0.370655065","213.8.195.70","10.0.0.32","TCP","2946","80  >  40934 [ACK] Seq=112321 Ack=507 Win=132352 Len=2880 TSval=728635367 TSecr=2621379380 [TCP segment of a reassembled PDU]"
"162","0.370685178","10.0.0.32","213.8.195.70","TCP","66","40934  >  80 [ACK] Seq=507 Ack=115201 Win=184832 Len=0 TSval=2621379393 TSecr=728635367"
"163","0.370907607","213.8.195.70","10.0.0.32","TCP","2946","80  >  40934 [ACK] Seq=115201 Ack=507 Win=132352 Len=2880 TSval=728635367 TSecr=2621379381 [TCP segment of a reassembled PDU]"
"164","0.370950301","10.0.0.32","213.8.195.70","TCP","66","40934  >  80 [ACK] Seq=507 Ack=118081 Win=184832 Len=0 TSval=2621379393 TSecr=728635367"
"165","0.371157035","213.8.195.70","10.0.0.32","TCP","1506","80  >  40934 [ACK] Seq=118081 Ack=507 Win=132352 Len=1440 TSval=728635367 TSecr=2621379381 [TCP segment of a reassembled PDU]"
"166","0.371408771","213.8.195.70","10.0.0.32","TCP","2946","80  >  40934 [ACK] Seq=119521 Ack=507 Win=132352 Len=2880 TSval=728635367 TSecr=2621379381 [TCP segment of a reassembled PDU]"
"167","0.371452056","10.0.0.32","213.8.195.70","TCP","66","40934  >  80 [ACK] Seq=507 Ack=122401 Win=184832 Len=0 TSval=2621379393 TSecr=728635367"
"168","0.371709578","213.8.195.70","10.0.0.32","TCP","1506","80  >  40934 [ACK] Seq=122401 Ack=507 Win=132352 Len=1440 TSval=728635367 TSecr=2621379381 [TCP segment of a reassembled PDU]"
"169","0.371953034","213.8.195.70","10.0.0.32","TCP","1506","80  >  40934 [ACK] Seq=123841 Ack=507 Win=132352 Len=1440 TSval=728635367 TSecr=2621379381 [TCP segment of a reassembled PDU]"
"170","0.371962012","10.0.0.32","213.8.195.70","TCP","66","40934  >  80 [ACK] Seq=507 Ack=125281 Win=184832 Len=0 TSval=2621379394 TSecr=728635367"
"171","0.372211745","213.8.195.70","10.0.0.32","TCP","1506","80  >  40934 [ACK] Seq=125281 Ack=507 Win=132352 Len=1440 TSval=728635367 TSecr=2621379381 [TCP segment of a reassembled PDU]"
"172","0.372220543","10.0.0.32","213.8.195.70","TCP","66","40934  >  80 [ACK] Seq=507 Ack=126721 Win=187776 Len=0 TSval=2621379394 TSecr=728635367"
"173","0.372481051","213.8.195.70","10.0.0.32","TCP","1506","80  >  40934 [ACK] Seq=126721 Ack=507 Win=132352 Len=1440 TSval=728635367 TSecr=2621379381 [TCP segment of a reassembled PDU]"
"174","0.372489840","10.0.0.32","213.8.195.70","TCP","66","40934  >  80 [ACK] Seq=507 Ack=128161 Win=190592 Len=0 TSval=2621379394 TSecr=728635367"
"175","0.372731321","213.8.195.70","10.0.0.32","TCP","1506","80  >  40934 [ACK] Seq=128161 Ack=507 Win=132352 Len=1440 TSval=728635367 TSecr=2621379381 [TCP segment of a reassembled PDU]"
"176","0.372739850","10.0.0.32","213.8.195.70","TCP","66","40934  >  80 [ACK] Seq=507 Ack=129601 Win=193536 Len=0 TSval=2621379395 TSecr=728635367"
"177","0.372744785","213.8.195.70","10.0.0.32","TCP","1506","80  >  40934 [ACK] Seq=129601 Ack=507 Win=132352 Len=1440 TSval=728635367 TSecr=2621379382 [TCP segment of a reassembled PDU]"
"178","0.372748839","10.0.0.32","213.8.195.70","TCP","66","40934  >  80 [ACK] Seq=507 Ack=131041 Win=196480 Len=0 TSval=2621379395 TSecr=728635367"
"179","0.372977680","213.8.195.70","10.0.0.32","TCP","2946","80  >  40934 [ACK] Seq=131041 Ack=507 Win=132352 Len=2880 TSval=728635367 TSecr=2621379382 [TCP segment of a reassembled PDU]"
"180","0.372986643","10.0.0.32","213.8.195.70","TCP","66","40934  >  80 [ACK] Seq=507 Ack=133921 Win=202240 Len=0 TSval=2621379395 TSecr=728635367"
"181","0.373248992","213.8.195.70","10.0.0.32","TCP","1506","80  >  40934 [ACK] Seq=133921 Ack=507 Win=132352 Len=1440 TSval=728635367 TSecr=2621379382 [TCP segment of a reassembled PDU]"
"182","0.373257501","10.0.0.32","213.8.195.70","TCP","66","40934  >  80 [ACK] Seq=507 Ack=135361 Win=205056 Len=0 TSval=2621379395 TSecr=728635367"
"183","0.373505648","213.8.195.70","10.0.0.32","TCP","1506","80  >  40934 [ACK] Seq=135361 Ack=507 Win=132352 Len=1440 TSval=728635367 TSecr=2621379382 [TCP segment of a reassembled PDU]"
"184","0.373514100","10.0.0.32","213.8.195.70","TCP","66","40934  >  80 [ACK] Seq=507 Ack=136801 Win=208000 Len=0 TSval=2621379395 TSecr=728635367"
"185","0.373763773","213.8.195.70","10.0.0.32","TCP","1569","80  >  40934 [PSH, ACK] Seq=136801 Ack=507 Win=132352 Len=1503 TSval=728635367 TSecr=2621379382 [TCP segment of a reassembled PDU]"
"186","0.373772282","10.0.0.32","213.8.195.70","TCP","66","40934  >  80 [ACK] Seq=507 Ack=138304 Win=210944 Len=0 TSval=2621379396 TSecr=728635367"
"187","0.375013819","213.8.195.70","10.0.0.32","TCP","1506","80  >  40934 [ACK] Seq=138304 Ack=507 Win=132352 Len=1440 TSval=728635367 TSecr=2621379385 [TCP segment of a reassembled PDU]"
"188","0.375022359","10.0.0.32","213.8.195.70","TCP","66","40934  >  80 [ACK] Seq=507 Ack=139744 Win=211200 Len=0 TSval=2621379397 TSecr=728635367"
"189","0.375283434","213.8.195.70","10.0.0.32","TCP","1506","80  >  40934 [ACK] Seq=139744 Ack=507 Win=132352 Len=1440 TSval=728635367 TSecr=2621379385 [TCP segment of a reassembled PDU]"
"190","0.375773014","213.8.195.70","10.0.0.32","TCP","2946","80  >  40934 [ACK] Seq=141184 Ack=507 Win=132352 Len=2880 TSval=728635367 TSecr=2621379385 [TCP segment of a reassembled PDU]"
"191","0.375814102","10.0.0.32","213.8.195.70","TCP","66","40934  >  80 [ACK] Seq=507 Ack=144064 Win=212224 Len=0 TSval=2621379398 TSecr=728635367"
"192","0.376027558","213.8.195.70","10.0.0.32","TCP","1506","80  >  40934 [ACK] Seq=144064 Ack=507 Win=132352 Len=1440 TSval=728635367 TSecr=2621379385 [TCP segment of a reassembled PDU]"
"193","0.376259041","213.8.195.70","10.0.0.32","TCP","1506","80  >  40934 [ACK] Seq=145504 Ack=507 Win=132352 Len=1440 TSval=728635367 TSecr=2621379385 [TCP segment of a reassembled PDU]"
"194","0.376311756","10.0.0.32","213.8.195.70","TCP","66","40934  >  80 [ACK] Seq=507 Ack=146944 Win=212224 Len=0 TSval=2621379398 TSecr=728635367"
"195","0.376556476","213.8.195.70","10.0.0.32","TCP","1506","80  >  40934 [ACK] Seq=146944 Ack=507 Win=132352 Len=1440 TSval=728635367 TSecr=2621379385 [TCP segment of a reassembled PDU]"
"196","0.376810894","213.8.195.70","10.0.0.32","TCP","1506","80  >  40934 [ACK] Seq=148384 Ack=507 Win=132352 Len=1440 TSval=728635367 TSecr=2621379385 [TCP segment of a reassembled PDU]"
"197","0.376862099","10.0.0.32","213.8.195.70","TCP","66","40934  >  80 [ACK] Seq=507 Ack=149824 Win=212224 Len=0 TSval=2621379399 TSecr=728635367"
"198","0.377059617","213.8.195.70","10.0.0.32","TCP","2946","80  >  40934 [ACK] Seq=149824 Ack=507 Win=132352 Len=2880 TSval=728635367 TSecr=2621379385 [TCP segment of a reassembled PDU]"
"199","0.377099241","10.0.0.32","213.8.195.70","TCP","66","40934  >  80 [ACK] Seq=507 Ack=152704 Win=212224 Len=0 TSval=2621379399 TSecr=728635367"
"200","0.377310972","213.8.195.70","10.0.0.32","TCP","2946","80  >  40934 [ACK] Seq=152704 Ack=507 Win=132352 Len=2880 TSval=728635367 TSecr=2621379385 [TCP segment of a reassembled PDU]"
"201","0.377350227","10.0.0.32","213.8.195.70","TCP","66","40934  >  80 [ACK] Seq=507 Ack=155584 Win=212224 Len=0 TSval=2621379399 TSecr=728635367"
"202","0.377856708","213.8.195.70","10.0.0.32","TCP","2946","80  >  40934 [ACK] Seq=155584 Ack=507 Win=132352 Len=2880 TSval=728635367 TSecr=2621379385 [TCP segment of a reassembled PDU]"
"203","0.377894932","10.0.0.32","213.8.195.70","TCP","66","40934  >  80 [ACK] Seq=507 Ack=158464 Win=212224 Len=0 TSval=2621379400 TSecr=728635367"
"204","0.378109906","213.8.195.70","10.0.0.32","TCP","2946","80  >  40934 [ACK] Seq=158464 Ack=507 Win=132352 Len=2880 TSval=728635367 TSecr=2621379385 [TCP segment of a reassembled PDU]"
"205","0.378147217","10.0.0.32","213.8.195.70","TCP","66","40934  >  80 [ACK] Seq=507 Ack=161344 Win=212224 Len=0 TSval=2621379400 TSecr=728635367"
"206","0.378608895","213.8.195.70","10.0.0.32","TCP","1506","80  >  40934 [ACK] Seq=161344 Ack=507 Win=132352 Len=1440 TSval=728635367 TSecr=2621379385 [TCP segment of a reassembled PDU]"
"207","0.378958529","213.8.195.70","10.0.0.32","TCP","1506","80  >  40934 [ACK] Seq=162784 Ack=507 Win=132352 Len=1440 TSval=728635367 TSecr=2621379385 [TCP segment of a reassembled PDU]"
"208","0.378988991","10.0.0.32","213.8.195.70","TCP","66","40934  >  80 [ACK] Seq=507 Ack=164224 Win=212224 Len=0 TSval=2621379401 TSecr=728635367"
"209","0.379215822","213.8.195.70","10.0.0.32","TCP","2946","80  >  40934 [ACK] Seq=164224 Ack=507 Win=132352 Len=2880 TSval=728635367 TSecr=2621379385 [TCP segment of a reassembled PDU]"
"210","0.379254557","10.0.0.32","213.8.195.70","TCP","66","40934  >  80 [ACK] Seq=507 Ack=167104 Win=212224 Len=0 TSval=2621379401 TSecr=728635367"
"211","0.379460580","213.8.195.70","10.0.0.32","TCP","1506","80  >  40934 [ACK] Seq=167104 Ack=507 Win=132352 Len=1440 TSval=728635367 TSecr=2621379385 [TCP segment of a reassembled PDU]"
"212","0.379770706","213.8.195.70","10.0.0.32","HTTP","2229","HTTP/1.1 200 OK  (text/javascript)"
"213","0.379822489","10.0.0.32","213.8.195.70","TCP","66","40934  >  80 [ACK] Seq=507 Ack=170707 Win=212224 Len=0 TSval=2621379402 TSecr=728635367"
"214","0.603671917","10.0.0.32","213.8.195.70","HTTP","539","GET /media/1242/hp_4.jpg HTTP/1.1 "
"215","0.605628690","10.0.0.32","213.8.195.70","HTTP","548","GET /media/1130/historymuseum.jpg HTTP/1.1 "
"216","0.606779858","10.0.0.32","213.8.195.70","TCP","74","40974  >  80 [SYN] Seq=0 Win=29200 Len=0 MSS=1460 SACK_PERM=1 TSval=2621379629 TSecr=0 WS=128"
"217","0.607208597","10.0.0.32","213.8.195.70","TCP","74","40976  >  80 [SYN] Seq=0 Win=29200 Len=0 MSS=1460 SACK_PERM=1 TSval=2621379629 TSecr=0 WS=128"
"218","0.608747577","10.0.0.32","213.8.195.70","TCP","74","40978  >  80 [SYN] Seq=0 Win=29200 Len=0 MSS=1460 SACK_PERM=1 TSval=2621379631 TSecr=0 WS=128"
"219","0.609407769","10.0.0.32","213.8.195.70","TCP","74","40980  >  80 [SYN] Seq=0 Win=29200 Len=0 MSS=1460 SACK_PERM=1 TSval=2621379631 TSecr=0 WS=128"
"220","0.619163996","213.8.195.70","10.0.0.32","TCP","74","80  >  40974 [SYN, ACK] Seq=0 Ack=1 Win=8192 Len=0 MSS=1452 WS=256 SACK_PERM=1 TSval=728635392 TSecr=2621379629"
"221","0.619194391","10.0.0.32","213.8.195.70","TCP","66","40974  >  80 [ACK] Seq=1 Ack=1 Win=29312 Len=0 TSval=2621379641 TSecr=728635392"
"222","0.619378658","10.0.0.32","213.8.195.70","HTTP","556","GET /media/1208/showslist_yadlagahal3.jpg HTTP/1.1 "
"223","0.619436144","213.8.195.70","10.0.0.32","TCP","74","80  >  40976 [SYN, ACK] Seq=0 Ack=1 Win=8192 Len=0 MSS=1452 WS=256 SACK_PERM=1 TSval=728635392 TSecr=2621379629"
"224","0.619449611","10.0.0.32","213.8.195.70","TCP","66","40976  >  80 [ACK] Seq=1 Ack=1 Win=29312 Len=0 TSval=2621379641 TSecr=728635392"
"225","0.619574380","10.0.0.32","213.8.195.70","HTTP","552","GET /media/1210/showslist_palmach.jpg HTTP/1.1 "
"226","0.620776477","213.8.195.70","10.0.0.32","TCP","74","80  >  40978 [SYN, ACK] Seq=0 Ack=1 Win=8192 Len=0 MSS=1452 WS=256 SACK_PERM=1 TSval=728635392 TSecr=2621379631"
"227","0.620796058","10.0.0.32","213.8.195.70","TCP","66","40978  >  80 [ACK] Seq=1 Ack=1 Win=29312 Len=0 TSval=2621379643 TSecr=728635392"
"228","0.620967968","10.0.0.32","213.8.195.70","HTTP","549","GET /media/1209/showslist_more.jpg HTTP/1.1 "
"229","0.621059996","213.8.195.70","10.0.0.32","TCP","74","80  >  40980 [SYN, ACK] Seq=0 Ack=1 Win=8192 Len=0 MSS=1452 WS=256 SACK_PERM=1 TSval=728635392 TSecr=2621379631"
"230","0.621076503","10.0.0.32","213.8.195.70","TCP","66","40980  >  80 [ACK] Seq=1 Ack=1 Win=29312 Len=0 TSval=2621379643 TSecr=728635392"
"231","0.621177774","10.0.0.32","213.8.195.70","HTTP","540","GET /media/1140/14368.jpg HTTP/1.1 "
"232","0.623396934","213.8.195.70","10.0.0.32","TCP","2946","80  >  40934 [ACK] Seq=170707 Ack=980 Win=131840 Len=2880 TSval=728635392 TSecr=2621379626 [TCP segment of a reassembled PDU]"
"233","0.623418211","10.0.0.32","213.8.195.70","TCP","66","40934  >  80 [ACK] Seq=980 Ack=173587 Win=210176 Len=0 TSval=2621379645 TSecr=728635392"
"234","0.623667456","213.8.195.70","10.0.0.32","TCP","1506","80  >  40934 [ACK] Seq=173587 Ack=980 Win=131840 Len=1440 TSval=728635392 TSecr=2621379626 [TCP segment of a reassembled PDU]"
"235","0.623676176","10.0.0.32","213.8.195.70","TCP","66","40934  >  80 [ACK] Seq=980 Ack=175027 Win=211200 Len=0 TSval=2621379646 TSecr=728635392"
"236","0.623916089","213.8.195.70","10.0.0.32","TCP","1506","80  >  40934 [ACK] Seq=175027 Ack=980 Win=131840 Len=1440 TSval=728635392 TSecr=2621379626 [TCP segment of a reassembled PDU]"
"237","0.623921166","10.0.0.32","213.8.195.70","TCP","66","40934  >  80 [ACK] Seq=980 Ack=176467 Win=211200 Len=0 TSval=2621379646 TSecr=728635392"
"238","0.624177833","213.8.195.70","10.0.0.32","TCP","1506","80  >  40934 [ACK] Seq=176467 Ack=980 Win=131840 Len=1440 TSval=728635392 TSecr=2621379626 [TCP segment of a reassembled PDU]"
"239","0.624184631","10.0.0.32","213.8.195.70","TCP","66","40934  >  80 [ACK] Seq=980 Ack=177907 Win=211200 Len=0 TSval=2621379646 TSecr=728635392"
"240","0.624428674","213.8.195.70","10.0.0.32","TCP","1506","80  >  40934 [ACK] Seq=177907 Ack=980 Win=131840 Len=1440 TSval=728635392 TSecr=2621379626 [TCP segment of a reassembled PDU]"
"241","0.624434184","10.0.0.32","213.8.195.70","TCP","66","40934  >  80 [ACK] Seq=980 Ack=179347 Win=211200 Len=0 TSval=2621379646 TSecr=728635392"
"242","0.624680828","213.8.195.70","10.0.0.32","TCP","2946","80  >  40934 [ACK] Seq=179347 Ack=980 Win=131840 Len=2880 TSval=728635392 TSecr=2621379626 [TCP segment of a reassembled PDU]"
"243","0.624686652","10.0.0.32","213.8.195.70","TCP","66","40934  >  80 [ACK] Seq=980 Ack=182227 Win=210176 Len=0 TSval=2621379647 TSecr=728635392"
"244","0.624946479","213.8.195.70","10.0.0.32","TCP","1506","80  >  40934 [ACK] Seq=182227 Ack=980 Win=131840 Len=1440 TSval=728635392 TSecr=2621379626 [TCP segment of a reassembled PDU]"
"245","0.624952010","10.0.0.32","213.8.195.70","TCP","66","40934  >  80 [ACK] Seq=980 Ack=183667 Win=211200 Len=0 TSval=2621379647 TSecr=728635392"
"246","0.625198760","213.8.195.70","10.0.0.32","TCP","2946","80  >  40934 [ACK] Seq=183667 Ack=980 Win=131840 Len=2880 TSval=728635392 TSecr=2621379626 [TCP segment of a reassembled PDU]"
"247","0.625206800","10.0.0.32","213.8.195.70","TCP","66","40934  >  80 [ACK] Seq=980 Ack=186547 Win=210176 Len=0 TSval=2621379647 TSecr=728635392"
