"No.","Time","Source","Destination","Protocol","Length","Info"
"1","0.000000000","10.0.0.32","149.126.73.254","TCP","74","58682  >  80 [SYN] Seq=0 Win=29200 Len=0 MSS=1460 SACK_PERM=1 TSval=1875959932 TSecr=0 WS=128"
"2","0.005635999","10.0.0.32","149.126.73.254","TCP","74","58684  >  80 [SYN] Seq=0 Win=29200 Len=0 MSS=1460 SACK_PERM=1 TSval=1875959937 TSecr=0 WS=128"
"3","0.013987844","149.126.73.254","10.0.0.32","TCP","74","80  >  58682 [SYN, ACK] Seq=0 Ack=1 Win=28960 Len=0 MSS=1452 SACK_PERM=1 TSval=1864617781 TSecr=1875959932 WS=128"
"4","0.014021813","10.0.0.32","149.126.73.254","TCP","66","58682  >  80 [ACK] Seq=1 Ack=1 Win=29312 Len=0 TSval=1875959946 TSecr=1864617781"
"5","0.014204733","10.0.0.32","149.126.73.254","HTTP","986","GET / HTTP/1.1 "
"6","0.017139105","149.126.73.254","10.0.0.32","TCP","74","80  >  58684 [SYN, ACK] Seq=0 Ack=1 Win=28960 Len=0 MSS=1452 SACK_PERM=1 TSval=1864617782 TSecr=1875959937 WS=128"
"7","0.017166550","10.0.0.32","149.126.73.254","TCP","66","58684  >  80 [ACK] Seq=1 Ack=1 Win=29312 Len=0 TSval=1875959949 TSecr=1864617782"
"8","0.026778960","149.126.73.254","10.0.0.32","TCP","66","80  >  58682 [ACK] Seq=1 Ack=921 Win=30848 Len=0 TSval=1864617784 TSecr=1875959946"
"9","0.621422809","149.126.73.254","10.0.0.32","TCP","2122","80  >  58682 [PSH, ACK] Seq=1 Ack=921 Win=30848 Len=2056 TSval=1864617933 TSecr=1875959946 [TCP segment of a reassembled PDU]"
"10","0.621456201","10.0.0.32","149.126.73.254","TCP","66","58682  >  80 [ACK] Seq=921 Ack=2057 Win=33408 Len=0 TSval=1875960553 TSecr=1864617933"
"11","0.711404577","149.126.73.254","10.0.0.32","TCP","2873","80  >  58682 [PSH, ACK] Seq=2057 Ack=921 Win=30848 Len=2807 TSval=1864617955 TSecr=1875960553 [TCP segment of a reassembled PDU]"
"12","0.711418450","10.0.0.32","149.126.73.254","TCP","66","58682  >  80 [ACK] Seq=921 Ack=4864 Win=39040 Len=0 TSval=1875960643 TSecr=1864617955"
"13","0.777814469","149.126.73.254","10.0.0.32","TCP","1473","80  >  58682 [PSH, ACK] Seq=4864 Ack=921 Win=30848 Len=1407 TSval=1864617972 TSecr=1875960643 [TCP segment of a reassembled PDU]"
"14","0.777840305","10.0.0.32","149.126.73.254","TCP","66","58682  >  80 [ACK] Seq=921 Ack=6271 Win=41856 Len=0 TSval=1875960709 TSecr=1864617972"
"15","1.132663924","149.126.73.254","10.0.0.32","TCP","1473","80  >  58682 [PSH, ACK] Seq=6271 Ack=921 Win=30848 Len=1407 TSval=1864618061 TSecr=1875960709 [TCP segment of a reassembled PDU]"
"16","1.132678684","10.0.0.32","149.126.73.254","TCP","66","58682  >  80 [ACK] Seq=921 Ack=7678 Win=44800 Len=0 TSval=1875961064 TSecr=1864618061"
"17","1.132689174","149.126.73.254","10.0.0.32","TCP","1473","80  >  58682 [PSH, ACK] Seq=7678 Ack=921 Win=30848 Len=1407 TSval=1864618061 TSecr=1875960709 [TCP segment of a reassembled PDU]"
"18","1.132695677","10.0.0.32","149.126.73.254","TCP","66","58682  >  80 [ACK] Seq=921 Ack=9085 Win=47616 Len=0 TSval=1875961064 TSecr=1864618061"
"19","1.133409087","149.126.73.254","10.0.0.32","TCP","1473","80  >  58682 [PSH, ACK] Seq=9085 Ack=921 Win=30848 Len=1407 TSval=1864618061 TSecr=1875960709 [TCP segment of a reassembled PDU]"
"20","1.133421167","10.0.0.32","149.126.73.254","TCP","66","58682  >  80 [ACK] Seq=921 Ack=10492 Win=50560 Len=0 TSval=1875961065 TSecr=1864618061"
"21","1.134242937","149.126.73.254","10.0.0.32","TCP","1473","80  >  58682 [PSH, ACK] Seq=10492 Ack=921 Win=30848 Len=1407 TSval=1864618061 TSecr=1875960709 [TCP segment of a reassembled PDU]"
"22","1.134256707","10.0.0.32","149.126.73.254","TCP","66","58682  >  80 [ACK] Seq=921 Ack=11899 Win=53504 Len=0 TSval=1875961066 TSecr=1864618061"
"23","1.134733603","149.126.73.254","10.0.0.32","TCP","1473","80  >  58682 [PSH, ACK] Seq=11899 Ack=921 Win=30848 Len=1407 TSval=1864618061 TSecr=1875960709 [TCP segment of a reassembled PDU]"
"24","1.134744329","10.0.0.32","149.126.73.254","TCP","66","58682  >  80 [ACK] Seq=921 Ack=13306 Win=56320 Len=0 TSval=1875961066 TSecr=1864618061"
"25","1.135005977","149.126.73.254","10.0.0.32","TCP","1473","80  >  58682 [PSH, ACK] Seq=13306 Ack=921 Win=30848 Len=1407 TSval=1864618061 TSecr=1875960709 [TCP segment of a reassembled PDU]"
"26","1.135016263","10.0.0.32","149.126.73.254","TCP","66","58682  >  80 [ACK] Seq=921 Ack=14713 Win=59264 Len=0 TSval=1875961067 TSecr=1864618061"
"27","1.135549787","149.126.73.254","10.0.0.32","TCP","1473","80  >  58682 [PSH, ACK] Seq=14713 Ack=921 Win=30848 Len=1407 TSval=1864618061 TSecr=1875960709 [TCP segment of a reassembled PDU]"
"28","1.135560504","10.0.0.32","149.126.73.254","TCP","66","58682  >  80 [ACK] Seq=921 Ack=16120 Win=62208 Len=0 TSval=1875961067 TSecr=1864618061"
"29","1.136610112","149.126.73.254","10.0.0.32","TCP","1473","80  >  58682 [PSH, ACK] Seq=16120 Ack=921 Win=30848 Len=1407 TSval=1864618062 TSecr=1875960709 [TCP segment of a reassembled PDU]"
"30","1.136622302","10.0.0.32","149.126.73.254","TCP","66","58682  >  80 [ACK] Seq=921 Ack=17527 Win=65024 Len=0 TSval=1875961068 TSecr=1864618062"
"31","1.137409361","149.126.73.254","10.0.0.32","TCP","1473","80  >  58682 [PSH, ACK] Seq=17527 Ack=921 Win=30848 Len=1407 TSval=1864618062 TSecr=1875960709 [TCP segment of a reassembled PDU]"
"32","1.137421147","10.0.0.32","149.126.73.254","TCP","66","58682  >  80 [ACK] Seq=921 Ack=18934 Win=67968 Len=0 TSval=1875961069 TSecr=1864618062"
"33","1.137429277","149.126.73.254","10.0.0.32","TCP","1473","80  >  58682 [PSH, ACK] Seq=18934 Ack=921 Win=30848 Len=1407 TSval=1864618062 TSecr=1875960709 [TCP segment of a reassembled PDU]"
"34","1.137433180","10.0.0.32","149.126.73.254","TCP","66","58682  >  80 [ACK] Seq=921 Ack=20341 Win=70784 Len=0 TSval=1875961069 TSecr=1864618062"
"35","1.143845304","149.126.73.254","10.0.0.32","TCP","1473","80  >  58682 [PSH, ACK] Seq=20341 Ack=921 Win=30848 Len=1407 TSval=1864618063 TSecr=1875961064 [TCP segment of a reassembled PDU]"
"36","1.143859024","10.0.0.32","149.126.73.254","TCP","66","58682  >  80 [ACK] Seq=921 Ack=21748 Win=73728 Len=0 TSval=1875961075 TSecr=1864618063"
"37","1.155978072","10.0.0.32","149.126.73.254","HTTP","1093","GET /wp-content/uploads/2019/05/------------------------------.jpg HTTP/1.1 "
"38","1.157398079","10.0.0.32","149.126.73.254","TCP","74","58700  >  80 [SYN] Seq=0 Win=29200 Len=0 MSS=1460 SACK_PERM=1 TSval=1875961089 TSecr=0 WS=128"
"39","1.168843313","149.126.73.254","10.0.0.32","TCP","66","80  >  58684 [ACK] Seq=1 Ack=1028 Win=31104 Len=0 TSval=1864618070 TSecr=1875961088"
"40","1.169210742","149.126.73.254","10.0.0.32","TCP","74","80  >  58700 [SYN, ACK] Seq=0 Ack=1 Win=28960 Len=0 MSS=1452 SACK_PERM=1 TSval=1864618070 TSecr=1875961089 WS=128"
"41","1.169236669","10.0.0.32","149.126.73.254","TCP","66","58700  >  80 [ACK] Seq=1 Ack=1 Win=29312 Len=0 TSval=1875961101 TSecr=1864618070"
"42","1.169378148","10.0.0.32","149.126.73.254","HTTP","1100","GET /wp-content/uploads/2019/05/-------------------------------236x158.jpg HTTP/1.1 "
"43","1.169984299","149.126.73.254","10.0.0.32","HTTP","376","HTTP/1.1 304 Not Modified "
"44","1.169995299","10.0.0.32","149.126.73.254","TCP","66","58684  >  80 [ACK] Seq=1028 Ack=311 Win=30336 Len=0 TSval=1875961102 TSecr=1864618070"
"45","1.172243295","149.126.73.254","10.0.0.32","TCP","1473","80  >  58682 [PSH, ACK] Seq=21748 Ack=921 Win=30848 Len=1407 TSval=1864618071 TSecr=1875961075 [TCP segment of a reassembled PDU]"
"46","1.172256192","10.0.0.32","149.126.73.254","TCP","66","58682  >  80 [ACK] Seq=921 Ack=23155 Win=76672 Len=0 TSval=1875961104 TSecr=1864618071"
"47","1.178253974","149.126.73.254","10.0.0.32","TCP","1506","80  >  58682 [ACK] Seq=23155 Ack=921 Win=30848 Len=1440 TSval=1864618072 TSecr=1875961075 [TCP segment of a reassembled PDU]"
"48","1.178267600","10.0.0.32","149.126.73.254","TCP","66","58682  >  80 [ACK] Seq=921 Ack=24595 Win=79488 Len=0 TSval=1875961110 TSecr=1864618072"
"49","1.178490785","149.126.73.254","10.0.0.32","TCP","1433","80  >  58682 [PSH, ACK] Seq=24595 Ack=921 Win=30848 Len=1367 TSval=1864618072 TSecr=1875961075 [TCP segment of a reassembled PDU]"
"50","1.178499371","10.0.0.32","149.126.73.254","TCP","66","58682  >  80 [ACK] Seq=921 Ack=25962 Win=82432 Len=0 TSval=1875961110 TSecr=1864618072"
"51","1.182012963","149.126.73.254","10.0.0.32","TCP","66","80  >  58700 [ACK] Seq=1 Ack=1035 Win=31104 Len=0 TSval=1864618073 TSecr=1875961101"
"52","1.183249018","149.126.73.254","10.0.0.32","HTTP","372","HTTP/1.1 304 Not Modified "
"53","1.183264681","10.0.0.32","149.126.73.254","TCP","66","58700  >  80 [ACK] Seq=1035 Ack=307 Win=30336 Len=0 TSval=1875961115 TSecr=1864618073"
"54","1.215851159","149.126.73.254","10.0.0.32","TCP","1473","80  >  58682 [PSH, ACK] Seq=25962 Ack=921 Win=30848 Len=1407 TSval=1864618081 TSecr=1875961110 [TCP segment of a reassembled PDU]"
"55","1.215863305","10.0.0.32","149.126.73.254","TCP","66","58682  >  80 [ACK] Seq=921 Ack=27369 Win=85376 Len=0 TSval=1875961147 TSecr=1864618081"
"56","1.215871670","149.126.73.254","10.0.0.32","HTTP","284","HTTP/1.1 200 OK  (text/html)"
"57","1.215875154","10.0.0.32","149.126.73.254","TCP","66","58682  >  80 [ACK] Seq=921 Ack=27587 Win=88192 Len=0 TSval=1875961147 TSecr=1864618081"
"58","1.233358404","10.0.0.32","149.126.73.254","HTTP","1045","GET /wp-content/plugins/slideshow-jquery-image-gallery/style/SlideshowPlugin/functional.css?ver=2.2.21 HTTP/1.1 "
"59","1.233864380","10.0.0.32","149.126.73.254","TCP","66","58684  >  80 [FIN, ACK] Seq=2007 Ack=311 Win=30336 Len=0 TSval=1875961165 TSecr=1864618070"
"60","1.246537398","149.126.73.254","10.0.0.32","HTTP","1067","HTTP/1.1 200 OK  (text/css)"
"61","1.246574280","10.0.0.32","149.126.73.254","TCP","54","58684  >  80 [RST] Seq=2008 Win=0 Len=0"
"62","1.246582315","149.126.73.254","10.0.0.32","TCP","66","80  >  58684 [FIN, ACK] Seq=1312 Ack=2008 Win=33152 Len=0 TSval=1864618089 TSecr=1875961165"
"63","1.246587490","10.0.0.32","149.126.73.254","TCP","54","58684  >  80 [RST] Seq=2008 Win=0 Len=0"
"64","2.623148721","10.0.0.32","149.126.73.254","HTTP","1035","GET /home HTTP/1.1 "
"65","2.635310327","149.126.73.254","10.0.0.32","TCP","66","80  >  58682 [ACK] Seq=27587 Ack=1890 Win=32768 Len=0 TSval=1864618437 TSecr=1875962555"
"66","3.285777910","149.126.73.254","10.0.0.32","HTTP","692","HTTP/1.1 301 Moved Permanently "
"67","3.285809923","10.0.0.32","149.126.73.254","TCP","66","58682  >  80 [ACK] Seq=1890 Ack=28213 Win=91136 Len=0 TSval=1875963217 TSecr=1864618599"
"68","3.291154265","10.0.0.32","149.126.73.254","HTTP","1031","GET / HTTP/1.1 "
"69","3.303725793","149.126.73.254","10.0.0.32","TCP","66","80  >  58682 [ACK] Seq=28213 Ack=2855 Win=34688 Len=0 TSval=1864618604 TSecr=1875963223"
"70","3.864324516","149.126.73.254","10.0.0.32","TCP","1506","80  >  58682 [ACK] Seq=28213 Ack=2855 Win=34688 Len=1440 TSval=1864618744 TSecr=1875963223 [TCP segment of a reassembled PDU]"
"71","3.864511272","149.126.73.254","10.0.0.32","TCP","684","80  >  58682 [PSH, ACK] Seq=29653 Ack=2855 Win=34688 Len=618 TSval=1864618744 TSecr=1875963223 [TCP segment of a reassembled PDU]"
"72","3.864526735","10.0.0.32","149.126.73.254","TCP","66","58682  >  80 [ACK] Seq=2855 Ack=30271 Win=96896 Len=0 TSval=1875963796 TSecr=1864618744"
"73","3.953500065","149.126.73.254","10.0.0.32","TCP","2873","80  >  58682 [PSH, ACK] Seq=30271 Ack=2855 Win=34688 Len=2807 TSval=1864618766 TSecr=1875963796 [TCP segment of a reassembled PDU]"
"74","3.953507491","10.0.0.32","149.126.73.254","TCP","66","58682  >  80 [ACK] Seq=2855 Ack=33078 Win=102528 Len=0 TSval=1875963885 TSecr=1864618766"
"75","4.013885263","149.126.73.254","10.0.0.32","TCP","1473","80  >  58682 [PSH, ACK] Seq=33078 Ack=2855 Win=34688 Len=1407 TSval=1864618781 TSecr=1875963885 [TCP segment of a reassembled PDU]"
"76","4.058658751","10.0.0.32","149.126.73.254","TCP","66","58682  >  80 [ACK] Seq=2855 Ack=34485 Win=105344 Len=0 TSval=1875963990 TSecr=1864618781"
"77","4.397921961","149.126.73.254","10.0.0.32","TCP","1473","80  >  58682 [PSH, ACK] Seq=34485 Ack=2855 Win=34688 Len=1407 TSval=1864618877 TSecr=1875963990 [TCP segment of a reassembled PDU]"
"78","4.397941147","10.0.0.32","149.126.73.254","TCP","66","58682  >  80 [ACK] Seq=2855 Ack=35892 Win=108288 Len=0 TSval=1875964330 TSecr=1864618877"
"79","4.398197568","149.126.73.254","10.0.0.32","TCP","1473","80  >  58682 [PSH, ACK] Seq=35892 Ack=2855 Win=34688 Len=1407 TSval=1864618877 TSecr=1875963990 [TCP segment of a reassembled PDU]"
"80","4.398212065","10.0.0.32","149.126.73.254","TCP","66","58682  >  80 [ACK] Seq=2855 Ack=37299 Win=111104 Len=0 TSval=1875964330 TSecr=1864618877"
"81","4.398721069","149.126.73.254","10.0.0.32","TCP","1473","80  >  58682 [PSH, ACK] Seq=37299 Ack=2855 Win=34688 Len=1407 TSval=1864618877 TSecr=1875963990 [TCP segment of a reassembled PDU]"
"82","4.398733466","10.0.0.32","149.126.73.254","TCP","66","58682  >  80 [ACK] Seq=2855 Ack=38706 Win=114048 Len=0 TSval=1875964330 TSecr=1864618877"
"83","4.399503828","149.126.73.254","10.0.0.32","TCP","1473","80  >  58682 [PSH, ACK] Seq=38706 Ack=2855 Win=34688 Len=1407 TSval=1864618877 TSecr=1875963990 [TCP segment of a reassembled PDU]"
"84","4.399515528","10.0.0.32","149.126.73.254","TCP","66","58682  >  80 [ACK] Seq=2855 Ack=40113 Win=116992 Len=0 TSval=1875964331 TSecr=1864618877"
"85","4.400295039","149.126.73.254","10.0.0.32","TCP","1473","80  >  58682 [PSH, ACK] Seq=40113 Ack=2855 Win=34688 Len=1407 TSval=1864618878 TSecr=1875963990 [TCP segment of a reassembled PDU]"
"86","4.400306389","10.0.0.32","149.126.73.254","TCP","66","58682  >  80 [ACK] Seq=2855 Ack=41520 Win=119808 Len=0 TSval=1875964332 TSecr=1864618878"
"87","4.400836224","149.126.73.254","10.0.0.32","TCP","1473","80  >  58682 [PSH, ACK] Seq=41520 Ack=2855 Win=34688 Len=1407 TSval=1864618878 TSecr=1875963990 [TCP segment of a reassembled PDU]"
"88","4.400847703","10.0.0.32","149.126.73.254","TCP","66","58682  >  80 [ACK] Seq=2855 Ack=42927 Win=122752 Len=0 TSval=1875964333 TSecr=1864618878"
"89","4.401527378","149.126.73.254","10.0.0.32","TCP","1473","80  >  58682 [PSH, ACK] Seq=42927 Ack=2855 Win=34688 Len=1407 TSval=1864618878 TSecr=1875963990 [TCP segment of a reassembled PDU]"
"90","4.401539057","10.0.0.32","149.126.73.254","TCP","66","58682  >  80 [ACK] Seq=2855 Ack=44334 Win=125696 Len=0 TSval=1875964333 TSecr=1864618878"
"91","4.402046656","149.126.73.254","10.0.0.32","TCP","1473","80  >  58682 [PSH, ACK] Seq=44334 Ack=2855 Win=34688 Len=1407 TSval=1864618878 TSecr=1875963990 [TCP segment of a reassembled PDU]"
"92","4.402057819","10.0.0.32","149.126.73.254","TCP","66","58682  >  80 [ACK] Seq=2855 Ack=45741 Win=128512 Len=0 TSval=1875964334 TSecr=1864618878"
"93","4.402302993","149.126.73.254","10.0.0.32","TCP","1473","80  >  58682 [PSH, ACK] Seq=45741 Ack=2855 Win=34688 Len=1407 TSval=1864618878 TSecr=1875963990 [TCP segment of a reassembled PDU]"
"94","4.402313699","10.0.0.32","149.126.73.254","TCP","66","58682  >  80 [ACK] Seq=2855 Ack=47148 Win=131456 Len=0 TSval=1875964334 TSecr=1864618878"
"95","4.402812081","149.126.73.254","10.0.0.32","TCP","1473","80  >  58682 [PSH, ACK] Seq=47148 Ack=2855 Win=34688 Len=1407 TSval=1864618878 TSecr=1875963990 [TCP segment of a reassembled PDU]"
"96","4.402823641","10.0.0.32","149.126.73.254","TCP","66","58682  >  80 [ACK] Seq=2855 Ack=48555 Win=134272 Len=0 TSval=1875964334 TSecr=1864618878"
"97","4.403086718","149.126.73.254","10.0.0.32","TCP","1473","80  >  58682 [PSH, ACK] Seq=48555 Ack=2855 Win=34688 Len=1407 TSval=1864618878 TSecr=1875963990 [TCP segment of a reassembled PDU]"
"98","4.403097288","10.0.0.32","149.126.73.254","TCP","66","58682  >  80 [ACK] Seq=2855 Ack=49962 Win=137216 Len=0 TSval=1875964335 TSecr=1864618878"
"99","4.431114298","149.126.73.254","10.0.0.32","TCP","1473","80  >  58682 [PSH, ACK] Seq=49962 Ack=2855 Win=34688 Len=1407 TSval=1864618885 TSecr=1875964335 [TCP segment of a reassembled PDU]"
"100","4.431126625","10.0.0.32","149.126.73.254","TCP","66","58682  >  80 [ACK] Seq=2855 Ack=51369 Win=140160 Len=0 TSval=1875964363 TSecr=1864618885"
"101","4.436704877","149.126.73.254","10.0.0.32","TCP","1473","80  >  58682 [PSH, ACK] Seq=51369 Ack=2855 Win=34688 Len=1407 TSval=1864618887 TSecr=1875964335 [TCP segment of a reassembled PDU]"
"102","4.436712944","10.0.0.32","149.126.73.254","TCP","66","58682  >  80 [ACK] Seq=2855 Ack=52776 Win=142976 Len=0 TSval=1875964368 TSecr=1864618887"
"103","4.437224096","149.126.73.254","10.0.0.32","TCP","1473","80  >  58682 [PSH, ACK] Seq=52776 Ack=2855 Win=34688 Len=1407 TSval=1864618887 TSecr=1875964335 [TCP segment of a reassembled PDU]"
"104","4.437234453","10.0.0.32","149.126.73.254","TCP","66","58682  >  80 [ACK] Seq=2855 Ack=54183 Win=145920 Len=0 TSval=1875964369 TSecr=1864618887"
"105","4.472713816","149.126.73.254","10.0.0.32","HTTP","1664","HTTP/1.1 200 OK  (text/html)"
"106","4.472722156","10.0.0.32","149.126.73.254","TCP","66","58682  >  80 [ACK] Seq=2855 Ack=55781 Win=149120 Len=0 TSval=1875964404 TSecr=1864618896"
"107","7.104814846","10.0.0.32","149.126.73.254","HTTP","1055","GET /product-category/givova/ HTTP/1.1 "
"108","7.117822494","149.126.73.254","10.0.0.32","TCP","66","80  >  58682 [ACK] Seq=55781 Ack=3844 Win=36736 Len=0 TSval=1864619557 TSecr=1875967037"
"109","7.780008171","149.126.73.254","10.0.0.32","TCP","2073","80  >  58682 [PSH, ACK] Seq=55781 Ack=3844 Win=36736 Len=2007 TSval=1864619722 TSecr=1875967037 [TCP segment of a reassembled PDU]"
"110","7.780033753","10.0.0.32","149.126.73.254","TCP","66","58682  >  80 [ACK] Seq=3844 Ack=57788 Win=153088 Len=0 TSval=1875967712 TSecr=1864619722"
"111","7.836161604","10.0.0.32","149.126.73.254","HTTP","1075","GET /wp-content/plugins/jquery-lightbox-for-native-galleries/colorbox/theme2/colorbox.css?ver=1.3.14 HTTP/1.1 "
"112","7.836985814","10.0.0.32","149.126.73.254","TCP","66","58700  >  80 [FIN, ACK] Seq=2044 Ack=307 Win=30336 Len=0 TSval=1875967769 TSecr=1864618073"
"113","7.849814612","149.126.73.254","10.0.0.32","TCP","66","80  >  58700 [FIN, ACK] Seq=307 Ack=2045 Win=33152 Len=0 TSval=1864619740 TSecr=1875967768"
"114","7.849844436","10.0.0.32","149.126.73.254","TCP","66","58700  >  80 [ACK] Seq=2045 Ack=308 Win=30336 Len=0 TSval=1875967782 TSecr=1864619740"
"115","7.855552815","10.0.0.32","149.126.73.254","TCP","74","58746  >  80 [SYN] Seq=0 Win=29200 Len=0 MSS=1460 SACK_PERM=1 TSval=1875967787 TSecr=0 WS=128"
"116","7.855826975","10.0.0.32","149.126.73.254","TCP","74","58748  >  80 [SYN] Seq=0 Win=29200 Len=0 MSS=1460 SACK_PERM=1 TSval=1875967788 TSecr=0 WS=128"
"117","7.859903343","10.0.0.32","149.126.73.254","TCP","74","58750  >  80 [SYN] Seq=0 Win=29200 Len=0 MSS=1460 SACK_PERM=1 TSval=1875967792 TSecr=0 WS=128"
"118","7.860203457","10.0.0.32","149.126.73.254","TCP","74","58752  >  80 [SYN] Seq=0 Win=29200 Len=0 MSS=1460 SACK_PERM=1 TSval=1875967792 TSecr=0 WS=128"
"119","7.861124330","10.0.0.32","149.126.73.254","TCP","74","58754  >  80 [SYN] Seq=0 Win=29200 Len=0 MSS=1460 SACK_PERM=1 TSval=1875967793 TSecr=0 WS=128"
"120","7.867412087","149.126.73.254","10.0.0.32","TCP","74","80  >  58746 [SYN, ACK] Seq=0 Ack=1 Win=28960 Len=0 MSS=1452 SACK_PERM=1 TSval=1864619744 TSecr=1875967787 WS=128"
"121","7.867436355","10.0.0.32","149.126.73.254","TCP","66","58746  >  80 [ACK] Seq=1 Ack=1 Win=29312 Len=0 TSval=1875967799 TSecr=1864619744"
"122","7.868211005","149.126.73.254","10.0.0.32","TCP","74","80  >  58748 [SYN, ACK] Seq=0 Ack=1 Win=28960 Len=0 MSS=1452 SACK_PERM=1 TSval=1864619745 TSecr=1875967788 WS=128"
"123","7.868224420","10.0.0.32","149.126.73.254","TCP","66","58748  >  80 [ACK] Seq=1 Ack=1 Win=29312 Len=0 TSval=1875967800 TSecr=1864619745"
"124","7.871411891","149.126.73.254","10.0.0.32","TCP","74","80  >  58750 [SYN, ACK] Seq=0 Ack=1 Win=28960 Len=0 MSS=1452 SACK_PERM=1 TSval=1864619745 TSecr=1875967792 WS=128"
"125","7.871426727","10.0.0.32","149.126.73.254","TCP","66","58750  >  80 [ACK] Seq=1 Ack=1 Win=29312 Len=0 TSval=1875967803 TSecr=1864619745"
"126","7.872211900","149.126.73.254","10.0.0.32","TCP","74","80  >  58752 [SYN, ACK] Seq=0 Ack=1 Win=28960 Len=0 MSS=1452 SACK_PERM=1 TSval=1864619746 TSecr=1875967792 WS=128"
"127","7.872224965","10.0.0.32","149.126.73.254","TCP","66","58752  >  80 [ACK] Seq=1 Ack=1 Win=29312 Len=0 TSval=1875967804 TSecr=1864619746"
"128","7.873011472","149.126.73.254","10.0.0.32","TCP","74","80  >  58754 [SYN, ACK] Seq=0 Ack=1 Win=28960 Len=0 MSS=1452 SACK_PERM=1 TSval=1864619746 TSecr=1875967793 WS=128"
"129","7.873024666","10.0.0.32","149.126.73.254","TCP","66","58754  >  80 [ACK] Seq=1 Ack=1 Win=29312 Len=0 TSval=1875967805 TSecr=1864619746"
"130","7.873616209","149.126.73.254","10.0.0.32","TCP","1506","80  >  58682 [ACK] Seq=57788 Ack=3844 Win=36736 Len=1440 TSval=1864619746 TSecr=1875967712 [TCP segment of a reassembled PDU]"
"131","7.873623838","10.0.0.32","149.126.73.254","TCP","66","58682  >  80 [ACK] Seq=3844 Ack=59228 Win=156032 Len=0 TSval=1875967805 TSecr=1864619746"
"132","7.873882089","149.126.73.254","10.0.0.32","TCP","1433","80  >  58682 [PSH, ACK] Seq=59228 Ack=3844 Win=36736 Len=1367 TSval=1864619746 TSecr=1875967712 [TCP segment of a reassembled PDU]"
"133","7.873888291","10.0.0.32","149.126.73.254","TCP","66","58682  >  80 [ACK] Seq=3844 Ack=60595 Win=158976 Len=0 TSval=1875967806 TSecr=1864619746"
"134","7.986821113","149.126.73.254","10.0.0.32","TCP","1506","80  >  58682 [ACK] Seq=60595 Ack=3844 Win=36736 Len=1440 TSval=1864619774 TSecr=1875967806 [TCP segment of a reassembled PDU]"
"135","7.986838270","10.0.0.32","149.126.73.254","TCP","66","58682  >  80 [ACK] Seq=3844 Ack=62035 Win=161792 Len=0 TSval=1875967919 TSecr=1864619774"
"136","7.987091972","149.126.73.254","10.0.0.32","TCP","1433","80  >  58682 [PSH, ACK] Seq=62035 Ack=3844 Win=36736 Len=1367 TSval=1864619774 TSecr=1875967806 [TCP segment of a reassembled PDU]"
"137","7.987098490","10.0.0.32","149.126.73.254","TCP","66","58682  >  80 [ACK] Seq=3844 Ack=63402 Win=164736 Len=0 TSval=1875967919 TSecr=1864619774"
"138","7.989342888","10.0.0.32","149.126.73.254","HTTP","1046","GET /wp-content/uploads/2019/04/------------------------------1-397x397.jpg HTTP/1.1 "
"139","8.001856089","149.126.73.254","10.0.0.32","TCP","66","80  >  58746 [ACK] Seq=1 Ack=981 Win=30976 Len=0 TSval=1864619778 TSecr=1875967921"
"140","8.003958625","149.126.73.254","10.0.0.32","TCP","1506","80  >  58746 [ACK] Seq=1 Ack=981 Win=30976 Len=1440 TSval=1864619779 TSecr=1875967921 [TCP segment of a reassembled PDU]"
"141","8.003968895","10.0.0.32","149.126.73.254","TCP","66","58746  >  80 [ACK] Seq=981 Ack=1441 Win=32128 Len=0 TSval=1875967936 TSecr=1864619779"
"142","8.004481893","149.126.73.254","10.0.0.32","TCP","2946","80  >  58746 [ACK] Seq=1441 Ack=981 Win=30976 Len=2880 TSval=1864619779 TSecr=1875967921 [TCP segment of a reassembled PDU]"
"143","8.004491480","10.0.0.32","149.126.73.254","TCP","66","58746  >  80 [ACK] Seq=981 Ack=4321 Win=37888 Len=0 TSval=1875967936 TSecr=1864619779"
"144","8.004748146","149.126.73.254","10.0.0.32","TCP","1506","80  >  58746 [ACK] Seq=4321 Ack=981 Win=30976 Len=1440 TSval=1864619779 TSecr=1875967921 [TCP segment of a reassembled PDU]"
"145","8.004756306","10.0.0.32","149.126.73.254","TCP","66","58746  >  80 [ACK] Seq=981 Ack=5761 Win=40832 Len=0 TSval=1875967937 TSecr=1864619779"
"146","8.004998556","149.126.73.254","10.0.0.32","TCP","1506","80  >  58746 [ACK] Seq=5761 Ack=981 Win=30976 Len=1440 TSval=1864619779 TSecr=1875967921 [TCP segment of a reassembled PDU]"
"147","8.005007186","10.0.0.32","149.126.73.254","TCP","66","58746  >  80 [ACK] Seq=981 Ack=7201 Win=43648 Len=0 TSval=1875967937 TSecr=1864619779"
"148","8.005252140","149.126.73.254","10.0.0.32","TCP","2946","80  >  58746 [ACK] Seq=7201 Ack=981 Win=30976 Len=2880 TSval=1864619779 TSecr=1875967921 [TCP segment of a reassembled PDU]"
"149","8.005261620","10.0.0.32","149.126.73.254","TCP","66","58746  >  80 [ACK] Seq=981 Ack=10081 Win=49408 Len=0 TSval=1875967937 TSecr=1864619779"
"150","8.005500281","149.126.73.254","10.0.0.32","TCP","1506","80  >  58746 [ACK] Seq=10081 Ack=981 Win=30976 Len=1440 TSval=1864619779 TSecr=1875967921 [TCP segment of a reassembled PDU]"
"151","8.005509284","10.0.0.32","149.126.73.254","TCP","66","58746  >  80 [ACK] Seq=981 Ack=11521 Win=52352 Len=0 TSval=1875967937 TSecr=1864619779"
"152","8.005764107","149.126.73.254","10.0.0.32","TCP","1506","80  >  58746 [ACK] Seq=11521 Ack=981 Win=30976 Len=1440 TSval=1864619779 TSecr=1875967921 [TCP segment of a reassembled PDU]"
"153","8.005770038","10.0.0.32","149.126.73.254","TCP","66","58746  >  80 [ACK] Seq=981 Ack=12961 Win=55296 Len=0 TSval=1875967938 TSecr=1864619779"
"154","8.006022829","149.126.73.254","10.0.0.32","TCP","1506","80  >  58746 [ACK] Seq=12961 Ack=981 Win=30976 Len=1440 TSval=1864619779 TSecr=1875967921 [TCP segment of a reassembled PDU]"
"155","8.006028244","10.0.0.32","149.126.73.254","TCP","66","58746  >  80 [ACK] Seq=981 Ack=14401 Win=58112 Len=0 TSval=1875967938 TSecr=1864619779"
"156","8.014820573","149.126.73.254","10.0.0.32","TCP","1506","80  >  58746 [ACK] Seq=14401 Ack=981 Win=30976 Len=1440 TSval=1864619781 TSecr=1875967936 [TCP segment of a reassembled PDU]"
"157","8.014828870","10.0.0.32","149.126.73.254","TCP","66","58746  >  80 [ACK] Seq=981 Ack=15841 Win=61056 Len=0 TSval=1875967947 TSecr=1864619781"
"158","8.015080590","149.126.73.254","10.0.0.32","TCP","1506","80  >  58746 [ACK] Seq=15841 Ack=981 Win=30976 Len=1440 TSval=1864619781 TSecr=1875967936 [TCP segment of a reassembled PDU]"
"159","8.015084345","10.0.0.32","149.126.73.254","TCP","66","58746  >  80 [ACK] Seq=981 Ack=17281 Win=64000 Len=0 TSval=1875967947 TSecr=1864619781"
"160","8.015333517","149.126.73.254","10.0.0.32","TCP","2946","80  >  58746 [ACK] Seq=17281 Ack=981 Win=30976 Len=2880 TSval=1864619781 TSecr=1875967936 [TCP segment of a reassembled PDU]"
"161","8.015339441","10.0.0.32","149.126.73.254","TCP","66","58746  >  80 [ACK] Seq=981 Ack=20161 Win=69760 Len=0 TSval=1875967947 TSecr=1864619781"
"162","8.015584825","149.126.73.254","10.0.0.32","TCP","2946","80  >  58746 [ACK] Seq=20161 Ack=981 Win=30976 Len=2880 TSval=1864619781 TSecr=1875967936 [TCP segment of a reassembled PDU]"
"163","8.015590711","10.0.0.32","149.126.73.254","TCP","66","58746  >  80 [ACK] Seq=981 Ack=23041 Win=75520 Len=0 TSval=1875967947 TSecr=1864619781"
"164","8.015594859","149.126.73.254","10.0.0.32","HTTP","415","HTTP/1.1 200 OK  (image/jpeg)"
"165","8.015599102","10.0.0.32","149.126.73.254","TCP","66","58746  >  80 [ACK] Seq=981 Ack=23390 Win=78336 Len=0 TSval=1875967947 TSecr=1864619781"
"166","8.181250600","149.126.73.254","10.0.0.32","TCP","1473","80  >  58682 [PSH, ACK] Seq=63402 Ack=3844 Win=36736 Len=1407 TSval=1864619823 TSecr=1875967919 [TCP segment of a reassembled PDU]"
"167","8.181263935","10.0.0.32","149.126.73.254","TCP","66","58682  >  80 [ACK] Seq=3844 Ack=64809 Win=167552 Len=0 TSval=1875968113 TSecr=1864619823"
"168","8.184142836","10.0.0.32","149.126.73.254","HTTP","1045","GET /wp-content/uploads/2019/04/-------------------------------397x397.jpg HTTP/1.1 "
"169","8.186368346","10.0.0.32","149.126.73.254","HTTP","1051","GET /wp-content/uploads/2019/04/d123babe-b125-46c4-b872-2676ead50f61-397x397.jpg HTTP/1.1 "
"170","8.186844257","10.0.0.32","149.126.73.254","HTTP","1035","GET /wp-content/uploads/2019/04/-------------------1-397x397.jpg HTTP/1.1 "
"171","8.198429613","149.126.73.254","10.0.0.32","TCP","1506","80  >  58746 [ACK] Seq=23390 Ack=1960 Win=32896 Len=1440 TSval=1864619827 TSecr=1875968116 [TCP segment of a reassembled PDU]"
"172","8.198449536","10.0.0.32","149.126.73.254","TCP","66","58746  >  80 [ACK] Seq=1960 Ack=24830 Win=81280 Len=0 TSval=1875968130 TSecr=1864619827"
"173","8.198711024","149.126.73.254","10.0.0.32","TCP","1506","80  >  58746 [ACK] Seq=24830 Ack=1960 Win=32896 Len=1440 TSval=1864619827 TSecr=1875968116 [TCP segment of a reassembled PDU]"
"174","8.198721549","10.0.0.32","149.126.73.254","TCP","66","58746  >  80 [ACK] Seq=1960 Ack=26270 Win=84096 Len=0 TSval=1875968130 TSecr=1864619827"
"175","8.198965875","149.126.73.254","10.0.0.32","TCP","2946","80  >  58746 [ACK] Seq=26270 Ack=1960 Win=32896 Len=2880 TSval=1864619827 TSecr=1875968116 [TCP segment of a reassembled PDU]"
"176","8.198976058","10.0.0.32","149.126.73.254","TCP","66","58746  >  80 [ACK] Seq=1960 Ack=29150 Win=89856 Len=0 TSval=1875968131 TSecr=1864619827"
"177","8.199234555","149.126.73.254","10.0.0.32","TCP","2946","80  >  58746 [ACK] Seq=29150 Ack=1960 Win=32896 Len=2880 TSval=1864619827 TSecr=1875968116 [TCP segment of a reassembled PDU]"
"178","8.199242874","10.0.0.32","149.126.73.254","TCP","66","58746  >  80 [ACK] Seq=1960 Ack=32030 Win=95616 Len=0 TSval=1875968131 TSecr=1864619827"
"179","8.199539382","149.126.73.254","10.0.0.32","TCP","1506","80  >  58746 [ACK] Seq=32030 Ack=1960 Win=32896 Len=1440 TSval=1864619827 TSecr=1875968116 [TCP segment of a reassembled PDU]"
"180","8.199551959","10.0.0.32","149.126.73.254","TCP","66","58746  >  80 [ACK] Seq=1960 Ack=33470 Win=98560 Len=0 TSval=1875968131 TSecr=1864619827"
"181","8.200064564","149.126.73.254","10.0.0.32","TCP","2946","80  >  58746 [ACK] Seq=33470 Ack=1960 Win=32896 Len=2880 TSval=1864619827 TSecr=1875968116 [TCP segment of a reassembled PDU]"
"182","8.200077772","10.0.0.32","149.126.73.254","TCP","66","58746  >  80 [ACK] Seq=1960 Ack=36350 Win=104320 Len=0 TSval=1875968132 TSecr=1864619827"
"183","8.200279022","149.126.73.254","10.0.0.32","TCP","1506","80  >  58746 [ACK] Seq=36350 Ack=1960 Win=32896 Len=1440 TSval=1864619827 TSecr=1875968116 [TCP segment of a reassembled PDU]"
"184","8.200287119","10.0.0.32","149.126.73.254","TCP","66","58746  >  80 [ACK] Seq=1960 Ack=37790 Win=107264 Len=0 TSval=1875968132 TSecr=1864619827"
"185","8.200527933","149.126.73.254","10.0.0.32","TCP","1506","80  >  58746 [ACK] Seq=37790 Ack=1960 Win=32896 Len=1440 TSval=1864619827 TSecr=1875968116 [TCP segment of a reassembled PDU]"
"186","8.200534867","10.0.0.32","149.126.73.254","TCP","66","58746  >  80 [ACK] Seq=1960 Ack=39230 Win=110080 Len=0 TSval=1875968132 TSecr=1864619827"
"187","8.200794276","149.126.73.254","10.0.0.32","TCP","1506","80  >  58746 [ACK] Seq=39230 Ack=1960 Win=32896 Len=1440 TSval=1864619827 TSecr=1875968116 [TCP segment of a reassembled PDU]"
"188","8.200800938","10.0.0.32","149.126.73.254","TCP","66","58746  >  80 [ACK] Seq=1960 Ack=40670 Win=113024 Len=0 TSval=1875968133 TSecr=1864619827"
"189","8.201048584","149.126.73.254","10.0.0.32","TCP","66","80  >  58748 [ACK] Seq=1 Ack=986 Win=30976 Len=0 TSval=1864619827 TSecr=1875968118"
"190","8.201059135","149.126.73.254","10.0.0.32","TCP","2946","80  >  58746 [ACK] Seq=40670 Ack=1960 Win=32896 Len=2880 TSval=1864619827 TSecr=1875968116 [TCP segment of a reassembled PDU]"
"191","8.201066338","10.0.0.32","149.126.73.254","TCP","66","58746  >  80 [ACK] Seq=1960 Ack=43550 Win=118784 Len=0 TSval=1875968133 TSecr=1864619827"
"192","8.201296155","149.126.73.254","10.0.0.32","TCP","1506","80  >  58748 [ACK] Seq=1 Ack=986 Win=30976 Len=1440 TSval=1864619828 TSecr=1875968118 [TCP segment of a reassembled PDU]"
"193","8.201303375","10.0.0.32","149.126.73.254","TCP","66","58748  >  80 [ACK] Seq=986 Ack=1441 Win=32128 Len=0 TSval=1875968133 TSecr=1864619828"
"194","8.201563441","149.126.73.254","10.0.0.32","TCP","1506","80  >  58748 [ACK] Seq=1441 Ack=986 Win=30976 Len=1440 TSval=1864619828 TSecr=1875968118 [TCP segment of a reassembled PDU]"
"195","8.201571929","10.0.0.32","149.126.73.254","TCP","66","58748  >  80 [ACK] Seq=986 Ack=2881 Win=35072 Len=0 TSval=1875968133 TSecr=1864619828"
"196","8.201812429","149.126.73.254","10.0.0.32","TCP","1506","80  >  58748 [ACK] Seq=2881 Ack=986 Win=30976 Len=1440 TSval=1864619828 TSecr=1875968118 [TCP segment of a reassembled PDU]"
"197","8.201818789","10.0.0.32","149.126.73.254","TCP","66","58748  >  80 [ACK] Seq=986 Ack=4321 Win=37888 Len=0 TSval=1875968134 TSecr=1864619828"
"198","8.202064726","149.126.73.254","10.0.0.32","TCP","2946","80  >  58748 [ACK] Seq=4321 Ack=986 Win=30976 Len=2880 TSval=1864619828 TSecr=1875968118 [TCP segment of a reassembled PDU]"
"199","8.202071706","10.0.0.32","149.126.73.254","TCP","66","58748  >  80 [ACK] Seq=986 Ack=7201 Win=43648 Len=0 TSval=1875968134 TSecr=1864619828"
"200","8.202316449","149.126.73.254","10.0.0.32","TCP","2946","80  >  58748 [ACK] Seq=7201 Ack=986 Win=30976 Len=2880 TSval=1864619828 TSecr=1875968118 [TCP segment of a reassembled PDU]"
"201","8.202323477","10.0.0.32","149.126.73.254","TCP","66","58748  >  80 [ACK] Seq=986 Ack=10081 Win=49408 Len=0 TSval=1875968134 TSecr=1864619828"
"202","8.202836234","149.126.73.254","10.0.0.32","TCP","2946","80  >  58748 [ACK] Seq=10081 Ack=986 Win=30976 Len=2880 TSval=1864619828 TSecr=1875968118 [TCP segment of a reassembled PDU]"
"203","8.202846642","10.0.0.32","149.126.73.254","TCP","66","58748  >  80 [ACK] Seq=986 Ack=12961 Win=55168 Len=0 TSval=1875968135 TSecr=1864619828"
"204","8.203085134","149.126.73.254","10.0.0.32","TCP","66","80  >  58750 [ACK] Seq=1 Ack=970 Win=30976 Len=0 TSval=1864619828 TSecr=1875968119"
"205","8.203093794","149.126.73.254","10.0.0.32","TCP","1506","80  >  58748 [ACK] Seq=12961 Ack=986 Win=30976 Len=1440 TSval=1864619828 TSecr=1875968118 [TCP segment of a reassembled PDU]"
"206","8.203099694","10.0.0.32","149.126.73.254","TCP","66","58748  >  80 [ACK] Seq=986 Ack=14401 Win=58112 Len=0 TSval=1875968135 TSecr=1864619828"
"207","8.204046077","149.126.73.254","10.0.0.32","TCP","1506","80  >  58750 [ACK] Seq=1 Ack=970 Win=30976 Len=1440 TSval=1864619829 TSecr=1875968119 [TCP segment of a reassembled PDU]"
"208","8.204055894","10.0.0.32","149.126.73.254","TCP","66","58750  >  80 [ACK] Seq=970 Ack=1441 Win=32128 Len=0 TSval=1875968136 TSecr=1864619829"
"209","8.204568725","149.126.73.254","10.0.0.32","TCP","1506","80  >  58750 [ACK] Seq=1441 Ack=970 Win=30976 Len=1440 TSval=1864619829 TSecr=1875968119 [TCP segment of a reassembled PDU]"
"210","8.204578362","10.0.0.32","149.126.73.254","TCP","66","58750  >  80 [ACK] Seq=970 Ack=2881 Win=35072 Len=0 TSval=1875968136 TSecr=1864619829"
"211","8.204806665","149.126.73.254","10.0.0.32","TCP","1506","80  >  58750 [ACK] Seq=2881 Ack=970 Win=30976 Len=1440 TSval=1864619829 TSecr=1875968119 [TCP segment of a reassembled PDU]"
"212","8.204813497","10.0.0.32","149.126.73.254","TCP","66","58750  >  80 [ACK] Seq=970 Ack=4321 Win=37888 Len=0 TSval=1875968137 TSecr=1864619829"
"213","8.205060367","149.126.73.254","10.0.0.32","TCP","1506","80  >  58750 [ACK] Seq=4321 Ack=970 Win=30976 Len=1440 TSval=1864619829 TSecr=1875968119 [TCP segment of a reassembled PDU]"
"214","8.205069620","10.0.0.32","149.126.73.254","TCP","66","58750  >  80 [ACK] Seq=970 Ack=5761 Win=40832 Len=0 TSval=1875968137 TSecr=1864619829"
"215","8.205313921","149.126.73.254","10.0.0.32","TCP","2946","80  >  58750 [ACK] Seq=5761 Ack=970 Win=30976 Len=2880 TSval=1864619829 TSecr=1875968119 [TCP segment of a reassembled PDU]"
"216","8.205323494","10.0.0.32","149.126.73.254","TCP","66","58750  >  80 [ACK] Seq=970 Ack=8641 Win=46592 Len=0 TSval=1875968137 TSecr=1864619829"
"217","8.205562455","149.126.73.254","10.0.0.32","TCP","2946","80  >  58750 [ACK] Seq=8641 Ack=970 Win=30976 Len=2880 TSval=1864619829 TSecr=1875968119 [TCP segment of a reassembled PDU]"
"218","8.205570435","10.0.0.32","149.126.73.254","TCP","66","58750  >  80 [ACK] Seq=970 Ack=11521 Win=52352 Len=0 TSval=1875968137 TSecr=1864619829"
"219","8.206102556","149.126.73.254","10.0.0.32","TCP","2946","80  >  58750 [ACK] Seq=11521 Ack=970 Win=30976 Len=2880 TSval=1864619829 TSecr=1875968119 [TCP segment of a reassembled PDU]"
"220","8.206112039","10.0.0.32","149.126.73.254","TCP","66","58750  >  80 [ACK] Seq=970 Ack=14401 Win=58112 Len=0 TSval=1875968138 TSecr=1864619829"
"221","8.209162412","149.126.73.254","10.0.0.32","HTTP","1116","HTTP/1.1 200 OK  (image/jpeg)"
"222","8.209172998","10.0.0.32","149.126.73.254","TCP","66","58746  >  80 [ACK] Seq=1960 Ack=44600 Win=121600 Len=0 TSval=1875968141 TSecr=1864619830"
"223","8.212428978","149.126.73.254","10.0.0.32","TCP","1506","80  >  58748 [ACK] Seq=14401 Ack=986 Win=30976 Len=1440 TSval=1864619831 TSecr=1875968133 [TCP segment of a reassembled PDU]"
"224","8.212443274","10.0.0.32","149.126.73.254","TCP","66","58748  >  80 [ACK] Seq=986 Ack=15841 Win=61056 Len=0 TSval=1875968144 TSecr=1864619831"
"225","8.212679563","149.126.73.254","10.0.0.32","TCP","2946","80  >  58748 [ACK] Seq=15841 Ack=986 Win=30976 Len=2880 TSval=1864619831 TSecr=1875968133 [TCP segment of a reassembled PDU]"
"226","8.212686489","10.0.0.32","149.126.73.254","TCP","66","58748  >  80 [ACK] Seq=986 Ack=18721 Win=66816 Len=0 TSval=1875968144 TSecr=1864619831"
"227","8.212925420","149.126.73.254","10.0.0.32","TCP","1506","80  >  58748 [ACK] Seq=18721 Ack=986 Win=30976 Len=1440 TSval=1864619831 TSecr=1875968133 [TCP segment of a reassembled PDU]"
"228","8.212930903","10.0.0.32","149.126.73.254","TCP","66","58748  >  80 [ACK] Seq=986 Ack=20161 Win=69632 Len=0 TSval=1875968145 TSecr=1864619831"
"229","8.213189027","149.126.73.254","10.0.0.32","HTTP","2332","HTTP/1.1 200 OK  (image/jpeg)"
"230","8.213194947","10.0.0.32","149.126.73.254","TCP","66","58748  >  80 [ACK] Seq=986 Ack=22427 Win=74240 Len=0 TSval=1875968145 TSecr=1864619831"
"231","8.215226563","149.126.73.254","10.0.0.32","TCP","1506","80  >  58750 [ACK] Seq=14401 Ack=970 Win=30976 Len=1440 TSval=1864619831 TSecr=1875968136 [TCP segment of a reassembled PDU]"
"232","8.215234553","10.0.0.32","149.126.73.254","TCP","66","58750  >  80 [ACK] Seq=970 Ack=15841 Win=61056 Len=0 TSval=1875968147 TSecr=1864619831"
"233","8.215492817","149.126.73.254","10.0.0.32","TCP","1506","80  >  58750 [ACK] Seq=15841 Ack=970 Win=30976 Len=1440 TSval=1864619831 TSecr=1875968136 [TCP segment of a reassembled PDU]"
"234","8.215501457","10.0.0.32","149.126.73.254","TCP","66","58750  >  80 [ACK] Seq=970 Ack=17281 Win=63872 Len=0 TSval=1875968147 TSecr=1864619831"
"235","8.216046857","149.126.73.254","10.0.0.32","HTTP","2398","HTTP/1.1 200 OK  (image/jpeg)"
"236","8.216054480","10.0.0.32","149.126.73.254","TCP","66","58750  >  80 [ACK] Seq=970 Ack=19613 Win=68608 Len=0 TSval=1875968148 TSecr=1864619831"
"237","8.293221097","149.126.73.254","10.0.0.32","TCP","1473","80  >  58682 [PSH, ACK] Seq=64809 Ack=3844 Win=36736 Len=1407 TSval=1864619851 TSecr=1875968113 [TCP segment of a reassembled PDU]"
"238","8.293237396","10.0.0.32","149.126.73.254","TCP","66","58682  >  80 [ACK] Seq=3844 Ack=66216 Win=170496 Len=0 TSval=1875968225 TSecr=1864619851"
"239","8.293244737","149.126.73.254","10.0.0.32","TCP","1473","80  >  58682 [PSH, ACK] Seq=66216 Ack=3844 Win=36736 Len=1407 TSval=1864619851 TSecr=1875968113 [TCP segment of a reassembled PDU]"
"240","8.293249308","10.0.0.32","149.126.73.254","TCP","66","58682  >  80 [ACK] Seq=3844 Ack=67623 Win=173440 Len=0 TSval=1875968225 TSecr=1864619851"
"241","8.302822966","149.126.73.254","10.0.0.32","TCP","1473","80  >  58682 [PSH, ACK] Seq=67623 Ack=3844 Win=36736 Len=1407 TSval=1864619853 TSecr=1875968113 [TCP segment of a reassembled PDU]"
"242","8.302837147","10.0.0.32","149.126.73.254","TCP","66","58682  >  80 [ACK] Seq=3844 Ack=69030 Win=176256 Len=0 TSval=1875968235 TSecr=1864619853"
"243","8.310750994","10.0.0.32","149.126.73.254","HTTP","1032","GET /wp-content/uploads/2019/04/------------------397x397.jpg HTTP/1.1 "
"244","8.311888977","10.0.0.32","149.126.73.254","HTTP","1034","GET /wp-content/uploads/2019/04/--------------------397x397.jpg HTTP/1.1 "
"245","8.314115001","10.0.0.32","149.126.73.254","HTTP","1033","GET /wp-content/uploads/2018/08/-----------------2-397x397.jpg HTTP/1.1 "
"246","8.318207368","10.0.0.32","149.126.73.254","HTTP","1073","GET /wp-content/plugins/woocommerce-better-product-addons-master/assets/css/frontend.css?ver=0.3.2 HTTP/1.1 "
"247","8.325229986","149.126.73.254","10.0.0.32","TCP","1506","80  >  58746 [ACK] Seq=44600 Ack=2926 Win=34944 Len=1440 TSval=1864619859 TSecr=1875968243 [TCP segment of a reassembled PDU]"
"248","8.325251221","10.0.0.32","149.126.73.254","TCP","66","58746  >  80 [ACK] Seq=2926 Ack=46040 Win=124544 Len=0 TSval=1875968257 TSecr=1864619859"
"249","8.325481936","149.126.73.254","10.0.0.32","TCP","4386","80  >  58746 [ACK] Seq=46040 Ack=2926 Win=34944 Len=4320 TSval=1864619859 TSecr=1875968243 [TCP segment of a reassembled PDU]"
"250","8.325489244","10.0.0.32","149.126.73.254","TCP","66","58746  >  80 [ACK] Seq=2926 Ack=50360 Win=133120 Len=0 TSval=1875968257 TSecr=1864619859"
"251","8.325729906","149.126.73.254","10.0.0.32","TCP","2946","80  >  58746 [ACK] Seq=50360 Ack=2926 Win=34944 Len=2880 TSval=1864619859 TSecr=1875968243 [TCP segment of a reassembled PDU]"
"252","8.325736302","10.0.0.32","149.126.73.254","TCP","66","58746  >  80 [ACK] Seq=2926 Ack=53240 Win=138880 Len=0 TSval=1875968258 TSecr=1864619859"
"253","8.325996637","149.126.73.254","10.0.0.32","TCP","1506","80  >  58746 [ACK] Seq=53240 Ack=2926 Win=34944 Len=1440 TSval=1864619859 TSecr=1875968243 [TCP segment of a reassembled PDU]"
"254","8.326002784","10.0.0.32","149.126.73.254","TCP","66","58746  >  80 [ACK] Seq=2926 Ack=54680 Win=141824 Len=0 TSval=1875968258 TSecr=1864619859"
"255","8.326246290","149.126.73.254","10.0.0.32","TCP","1506","80  >  58746 [ACK] Seq=54680 Ack=2926 Win=34944 Len=1440 TSval=1864619859 TSecr=1875968243 [TCP segment of a reassembled PDU]"
"256","8.326252301","10.0.0.32","149.126.73.254","TCP","66","58746  >  80 [ACK] Seq=2926 Ack=56120 Win=144768 Len=0 TSval=1875968258 TSecr=1864619859"
"257","8.326497956","149.126.73.254","10.0.0.32","TCP","2946","80  >  58746 [ACK] Seq=56120 Ack=2926 Win=34944 Len=2880 TSval=1864619859 TSecr=1875968243 [TCP segment of a reassembled PDU]"
"258","8.326504381","10.0.0.32","149.126.73.254","TCP","66","58746  >  80 [ACK] Seq=2926 Ack=59000 Win=150528 Len=0 TSval=1875968258 TSecr=1864619859"
"259","8.326764611","149.126.73.254","10.0.0.32","TCP","1506","80  >  58746 [ACK] Seq=59000 Ack=2926 Win=34944 Len=1440 TSval=1864619859 TSecr=1875968243 [TCP segment of a reassembled PDU]"
"260","8.326772980","10.0.0.32","149.126.73.254","TCP","66","58746  >  80 [ACK] Seq=2926 Ack=60440 Win=153344 Len=0 TSval=1875968259 TSecr=1864619859"
"261","8.327014012","149.126.73.254","10.0.0.32","HTTP","1266","HTTP/1.1 200 OK  (image/jpeg)"
"262","8.327021017","10.0.0.32","149.126.73.254","TCP","66","58746  >  80 [ACK] Seq=2926 Ack=61640 Win=156288 Len=0 TSval=1875968259 TSecr=1864619859"
"263","8.327266029","149.126.73.254","10.0.0.32","TCP","2946","80  >  58748 [ACK] Seq=22427 Ack=1954 Win=33024 Len=2880 TSval=1864619859 TSecr=1875968244 [TCP segment of a reassembled PDU]"
"264","8.327277220","10.0.0.32","149.126.73.254","TCP","66","58748  >  80 [ACK] Seq=1954 Ack=25307 Win=80000 Len=0 TSval=1875968259 TSecr=1864619859"
"265","8.327516875","149.126.73.254","10.0.0.32","TCP","2946","80  >  58748 [ACK] Seq=25307 Ack=1954 Win=33024 Len=2880 TSval=1864619859 TSecr=1875968244 [TCP segment of a reassembled PDU]"
"266","8.327523502","10.0.0.32","149.126.73.254","TCP","66","58748  >  80 [ACK] Seq=1954 Ack=28187 Win=85760 Len=0 TSval=1875968259 TSecr=1864619859"
"267","8.328032788","149.126.73.254","10.0.0.32","TCP","1506","80  >  58748 [ACK] Seq=28187 Ack=1954 Win=33024 Len=1440 TSval=1864619859 TSecr=1875968244 [TCP segment of a reassembled PDU]"
"268","8.328039690","10.0.0.32","149.126.73.254","TCP","66","58748  >  80 [ACK] Seq=1954 Ack=29627 Win=88576 Len=0 TSval=1875968260 TSecr=1864619859"
"269","8.328297702","149.126.73.254","10.0.0.32","TCP","1506","80  >  58748 [ACK] Seq=29627 Ack=1954 Win=33024 Len=1440 TSval=1864619859 TSecr=1875968244 [TCP segment of a reassembled PDU]"
"270","8.328303909","10.0.0.32","149.126.73.254","TCP","66","58748  >  80 [ACK] Seq=1954 Ack=31067 Win=91520 Len=0 TSval=1875968260 TSecr=1864619859"
"271","8.328547053","10.0.0.32","149.126.73.254","HTTP","1043","GET /wp-content/plugins/woocommerce/assets/js/frontend/add-to-cart.min.js?ver=2.2.8 HTTP/1.1 "
"272","8.328550855","149.126.73.254","10.0.0.32","TCP","2946","80  >  58748 [ACK] Seq=31067 Ack=1954 Win=33024 Len=2880 TSval=1864619859 TSecr=1875968244 [TCP segment of a reassembled PDU]"
"273","8.328557770","10.0.0.32","149.126.73.254","TCP","66","58748  >  80 [ACK] Seq=1954 Ack=33947 Win=97280 Len=0 TSval=1875968260 TSecr=1864619859"
"274","8.328800347","149.126.73.254","10.0.0.32","TCP","1506","80  >  58748 [ACK] Seq=33947 Ack=1954 Win=33024 Len=1440 TSval=1864619859 TSecr=1875968244 [TCP segment of a reassembled PDU]"
"275","8.328807692","10.0.0.32","149.126.73.254","TCP","66","58748  >  80 [ACK] Seq=1954 Ack=35387 Win=100224 Len=0 TSval=1875968261 TSecr=1864619859"
"276","8.328888482","10.0.0.32","149.126.73.254","HTTP","1051","GET /wp-content/plugins/woocommerce/assets/js/jquery-blockui/jquery.blockUI.min.js?ver=2.60 HTTP/1.1 "
"277","8.329051048","149.126.73.254","10.0.0.32","TCP","1506","80  >  58748 [ACK] Seq=35387 Ack=1954 Win=33024 Len=1440 TSval=1864619859 TSecr=1875968244 [TCP segment of a reassembled PDU]"
"278","8.329057900","10.0.0.32","149.126.73.254","TCP","66","58748  >  80 [ACK] Seq=1954 Ack=36827 Win=103040 Len=0 TSval=1875968261 TSecr=1864619859"
"279","8.329300580","149.126.73.254","10.0.0.32","HTTP","2862","HTTP/1.1 200 OK  (image/jpeg)"
"280","8.329308053","10.0.0.32","149.126.73.254","TCP","66","58748  >  80 [ACK] Seq=1954 Ack=39623 Win=108672 Len=0 TSval=1875968261 TSecr=1864619859"
"281","8.329431469","10.0.0.32","149.126.73.254","HTTP","1043","GET /wp-content/plugins/woocommerce/assets/js/frontend/woocommerce.min.js?ver=2.2.8 HTTP/1.1 "
"282","8.330427610","149.126.73.254","10.0.0.32","TCP","1506","80  >  58750 [ACK] Seq=19613 Ack=1937 Win=32896 Len=1440 TSval=1864619860 TSecr=1875968246 [TCP segment of a reassembled PDU]"
"283","8.330439394","10.0.0.32","149.126.73.254","TCP","66","58750  >  80 [ACK] Seq=1937 Ack=21053 Win=71424 Len=0 TSval=1875968262 TSecr=1864619860"
"284","8.330950731","149.126.73.254","10.0.0.32","TCP","2946","80  >  58750 [ACK] Seq=21053 Ack=1937 Win=32896 Len=2880 TSval=1864619860 TSecr=1875968246 [TCP segment of a reassembled PDU]"
"285","8.330958645","10.0.0.32","149.126.73.254","TCP","66","58750  >  80 [ACK] Seq=1937 Ack=23933 Win=77184 Len=0 TSval=1875968263 TSecr=1864619860"
"286","8.331202022","149.126.73.254","10.0.0.32","TCP","2946","80  >  58750 [ACK] Seq=23933 Ack=1937 Win=32896 Len=2880 TSval=1864619860 TSecr=1875968246 [TCP segment of a reassembled PDU]"
"287","8.331209442","10.0.0.32","149.126.73.254","TCP","66","58750  >  80 [ACK] Seq=1937 Ack=26813 Win=82944 Len=0 TSval=1875968263 TSecr=1864619860"
"288","8.331449689","149.126.73.254","10.0.0.32","TCP","1506","80  >  58750 [ACK] Seq=26813 Ack=1937 Win=32896 Len=1440 TSval=1864619860 TSecr=1875968246 [TCP segment of a reassembled PDU]"
"289","8.331455288","10.0.0.32","149.126.73.254","TCP","66","58750  >  80 [ACK] Seq=1937 Ack=28253 Win=85888 Len=0 TSval=1875968263 TSecr=1864619860"
"290","8.331700127","149.126.73.254","10.0.0.32","HTTP","2470","HTTP/1.1 200 OK  (image/jpeg)"
"291","8.331705396","10.0.0.32","149.126.73.254","TCP","66","58750  >  80 [ACK] Seq=1937 Ack=30657 Win=90752 Len=0 TSval=1875968263 TSecr=1864619860"
"292","8.331708590","149.126.73.254","10.0.0.32","TCP","66","80  >  58752 [ACK] Seq=1 Ack=1008 Win=30976 Len=0 TSval=1864619860 TSecr=1875968250"
"293","8.331786188","10.0.0.32","149.126.73.254","HTTP","1050","GET /wp-content/plugins/woocommerce/assets/js/jquery-cookie/jquery.cookie.min.js?ver=1.3.1 HTTP/1.1 "
"294","8.331953086","149.126.73.254","10.0.0.32","HTTP","696","HTTP/1.1 200 OK  (text/css)"
"295","8.331957751","10.0.0.32","149.126.73.254","TCP","66","58752  >  80 [ACK] Seq=1008 Ack=631 Win=30464 Len=0 TSval=1875968264 TSecr=1864619860"
"296","8.332178343","10.0.0.32","149.126.73.254","HTTP","1046","GET /wp-content/plugins/woocommerce/assets/js/frontend/cart-fragments.min.js?ver=2.2.8 HTTP/1.1 "
"297","8.334563730","149.126.73.254","10.0.0.32","HTTP","486","HTTP/1.1 200 OK  (text/html)"
"298","8.334573163","10.0.0.32","149.126.73.254","TCP","66","58682  >  80 [ACK] Seq=3844 Ack=69450 Win=179072 Len=0 TSval=1875968266 TSecr=1864619861"
"299","8.342402444","149.126.73.254","10.0.0.32","HTTP","1336","HTTP/1.1 200 OK  (application/javascript)"
"300","8.343422515","149.126.73.254","10.0.0.32","TCP","66","80  >  58754 [ACK] Seq=1 Ack=986 Win=30976 Len=0 TSval=1864619864 TSecr=1875968261"
"301","8.344427470","149.126.73.254","10.0.0.32","TCP","1506","80  >  58754 [ACK] Seq=1 Ack=986 Win=30976 Len=1440 TSval=1864619864 TSecr=1875968261 [TCP segment of a reassembled PDU]"
"302","8.344434642","10.0.0.32","149.126.73.254","TCP","66","58754  >  80 [ACK] Seq=986 Ack=1441 Win=32128 Len=0 TSval=1875968276 TSecr=1864619864"
"303","8.344680336","149.126.73.254","10.0.0.32","HTTP","2286","HTTP/1.1 200 OK  (application/javascript)"
"304","8.344685831","10.0.0.32","149.126.73.254","TCP","66","58754  >  80 [ACK] Seq=986 Ack=3661 Win=36608 Len=0 TSval=1875968276 TSecr=1864619864"
"305","8.346731397","149.126.73.254","10.0.0.32","HTTP","919","HTTP/1.1 200 OK  (application/javascript)"
"306","8.346960447","10.0.0.32","149.126.73.254","HTTP","1053","GET /wp-content/plugins/woocommerce/assets/js/frontend/add-to-cart-variation.min.js?ver=2.2.8 HTTP/1.1 "
"307","8.347204946","10.0.0.32","149.126.73.254","HTTP","1058","GET /wp-content/plugins/woocommerce-better-product-addons-master/assets/js/accounting.js?ver=0.3.2 HTTP/1.1 "
"308","8.347713199","10.0.0.32","149.126.73.254","HTTP","1052","GET /wp-content/plugins/woocommerce-better-product-addons-master/assets/js/addons.js?ver=1.0 HTTP/1.1 "
"309","8.349161656","149.126.73.254","10.0.0.32","HTTP","1090","HTTP/1.1 200 OK  (application/javascript)"
"310","8.351149507","149.126.73.254","10.0.0.32","HTTP","1036","HTTP/1.1 200 OK  (application/javascript)"
"311","8.360831288","149.126.73.254","10.0.0.32","HTTP","2296","HTTP/1.1 200 OK  (application/javascript)"
"312","8.360848581","10.0.0.32","149.126.73.254","TCP","66","58746  >  80 [ACK] Seq=4890 Ack=65140 Win=163584 Len=0 TSval=1875968293 TSecr=1864619868"
"313","8.363257806","149.126.73.254","10.0.0.32","HTTP","2086","HTTP/1.1 200 OK  (application/javascript)"
"314","8.363271536","10.0.0.32","149.126.73.254","TCP","66","58748  >  80 [ACK] Seq=3923 Ack=42496 Win=115584 Len=0 TSval=1875968295 TSecr=1864619868"
"315","8.364830355","149.126.73.254","10.0.0.32","HTTP","1640","HTTP/1.1 200 OK  (application/javascript)"
"316","8.364845319","10.0.0.32","149.126.73.254","TCP","66","58754  >  80 [ACK] Seq=1972 Ack=5235 Win=39808 Len=0 TSval=1875968297 TSecr=1864619869"
"317","8.394673923","10.0.0.32","149.126.73.254","TCP","66","58750  >  80 [ACK] Seq=2921 Ack=31681 Win=93568 Len=0 TSval=1875968326 TSecr=1864619865"
"318","8.394680614","10.0.0.32","149.126.73.254","TCP","66","58752  >  80 [ACK] Seq=1988 Ack=1601 Win=32512 Len=0 TSval=1875968326 TSecr=1864619865"
"319","8.464808676","10.0.0.32","149.126.73.254","HTTP","1149","POST /wp-admin/admin-ajax.php HTTP/1.1  (application/x-www-form-urlencoded)"
"320","8.515402892","149.126.73.254","10.0.0.32","TCP","66","80  >  58746 [ACK] Seq=65140 Ack=5973 Win=40960 Len=0 TSval=1864619907 TSecr=1875968397"
"321","9.245172949","149.126.73.254","10.0.0.32","HTTP","999","HTTP/1.1 200 OK  (application/json)"
"322","9.286684038","10.0.0.32","149.126.73.254","TCP","66","58746  >  80 [ACK] Seq=5973 Ack=66073 Win=166528 Len=0 TSval=1875969218 TSecr=1864620089"
